"ID","Comments_ID","Language","Description"
"2","12","DE","Auf der Karte von Westphalen von Le Coq (1796-1813) ist die Straße zwischen Heede und Rhede als ""nur bei trockenem Wetter zu gebrauchen"" gekennzeichnet."
"8","14","DE","Nach einem Protokoll aus 1690 gab es zwischen Salzwedel und Lübbow nur einen Fußsteig, und es wurde entschieden den Fußsteig zu einem Fahrweg auszubauen und eine Brücke zu errichten. Es ist unklar in wieweit dies dem Zustand im Spätmittelalter entspricht, oder ob die Straße einmal auch vom Frachtverkehr benutzt wurde und später verfallen war: für beide Möglichkeiten gibt es Belege. Jedenfalls war zu jeder Zeit die Wasserstraße zwischen Salzwedel und Lüchow eine wichtige Alternative für den Landverkehr."
"10","16","DE","Vermutlich wurde die direkte Verbindung zwischen Siek und Sandesneben über Schönberg erst üblich für den Fernverkehr im 17. Jh.; im Mittelalter muss der Verkehr haupsächlich die Straße über die Zollstelle Trittau benutzt haben."
"12","18","DE","Auf der Kurhannoversche Landesaufnahme (1764-1784) ist die Straße zwischen Escheburg und Schnakenbek über Geesthacht als ""Postweg im Winter nach Lauenburg"" gekennzeichnet. Im Sommer wurde eine nördlichere Strecke genommen, über Fahrendorf und and Krukow vorbei, Geesthacht umgehend."
"14","20","DE","Die Straße zwischen Iprump und Dingstede über Ganderkesee, Delmenhorst umgehend, war die Haupstrecke vor 1311. Auch später wurde die Straße benutzt wenn die Straße über Delmenhorst überschwemmt war."
"16","22","DE","Nach Aulepp (1975) eine im Hochmittelalter verwendete Trasse nach Norden aus Mühlhausen. Nach Born (2017) verlief hier der sogenannte Zellsche Marktstieg. Es handelte sich um einen für den Fußverkehr gedachten Stieg, der den Mühlhäuser Landgraben über eine hölzerne Brücke querte. 1611 wurde festgestellt, dass der Stieg illegal verbreitert wurde, sodass 1621 sämtliche hölzernen Stiege über den Mühlhäuser Landgraben abmontiert wurden (Born 2017, 22)."
"18","24","DE","Die Straße erhielt im Spätmittelalter mehr Bedeutung."
"20","26","DE","Diese Trasse hat ab dem Hoch- bis Spätmittelalter ihre größte Bedeutung. 1609 wird sie als Geleitsstraße nach Dingelstädt geführt."
"22","28","DE","Geleitsstraße von 1575."
"24","30","DE","Dieser Abschnitt der Straße rekonsturiert nach Eberhardt (1982), nach dem die westliche Route nach Tennstedt bis in jüngste Zeit versumpft war bzw. durch ein stehendes Gewässer unpassierbar war. Sperrung dieser Straße von Eisenach nach Weißensee im 15. Jh, um den Verkehr nach Erfurt zu zwingen."
"26","32","DE","Sperrung dieser Straße von Eisenach nach Weißensee im 15. Jh, um den Verkehr über Erfurt zu zwingen."
"30","36","DE","""Roter Steiger""; laut Nagel (2001) Aufgang in den Harz von Quedlinburg aus."
"32","38","DE","Historische Verbindung zwischen Quedlinburg und Hoym über die Wüstung Groß Orden nach Nagel (2001)."
"34","40","DE","Hochwasserfreier Umweg von Halle nach Merseburg."
"36","42","DE","Die Zollstelle in Altengottern zeigt, dass der alte Weinberg zwischen Mühlhausen und Langensalza bis ins 15. Jahrhundert nördlich umgangen wurde."
"38","44","DE","Nach Bahn (2002) handelt es sich hier um den früheren (frühmittelalterlichen) Verlauf der Via regia zwischen Erfurt und Naumburg."
"40","46","DE","Dieser Teil der Straße stammt aus dem 19. Jahrhundert und ist seither Teil der 'modernen' Via regia."
"42","48","DE","Seit vermutlich dem 13. Jahrhundert vorherrschender Zweig der Via regia."
"44","50","DE","Diese Straße wird bereits 1414 als ""Judenstraße"" genannt."
"46","34","DE","Nach Bruns-Weczerka 1967 wird diese Straße erst seit dem 16. Jahrhundert als Haupstraße genutzt. Seit 1450 bestand zwischen den Orten Edersleben und Oberröblingen ein Damm, der die Helmeüberquerung erleichterte und die Strecke attraktiver machte."
"48","52","DE","""Weinstraße"" oder ""Fuldaer Straße"" genannter Abschnitt der Via regia."
"50","54","DE","Teil der ""Kinzigstraße"", einem Abschnitt der Via regia zwischen Frankfurt/M. und Eisenach."
"52","56","DE","Die Straße zwischen Haselünne und Wietmarschen über Teglingen, Geeste und Dalum ist erstmals für das 18. Jh. bezeugt. Ihre Bedeutung für frühere Jahrhunderte ist ungeklart; das Hauptteil des Verkehrs muss die Strecke über den Flussübergang in Lingen genommen haben."
"54","58","DE","Diese Straße war eine überflutungsfreie Alternative zwischen Rudolstadt und Saalfeld."
"56","60","DE","Nach Bruns-Weczerka (1967) handelte es sich hier um die frühere Strecke zwischen Merseburg und Naumburg, erst später Abgelöst von der Strecke über Markröhlitz."
"58","62","DE","Diese Straße wurde 1470 von den Ernestinern verboten, allerdings kann davon ausgegangen werden, dass die Straße auch weiterhin genutzt wurde."
"60","64","DE","Dieser Straßenabschnitt musste bis 1704 den Weißenseer Obersee umgehen, der dann jedoch trockengelegt wurde (Stadt Weißensee 1998, 255f.). Sperrung dieser Straße von Eisenach nach Weißensee im 15. Jh, um den Verkehr über Erfurt zu zwingen (Eberhardt 1982)."
"62","66","DE","Seit 1515 vertraglich festgelegte Zwangsstraße von Lübeck, Hamburg und Eisleben über den Harz nach Thüringen. In einen Bericht nach Guthmannshausen heißt es, dass die Waren von Lübeck, Braunschweig und Magdeburg nach Franken jeher die Straße über Nebra, Tauhardt und Guthmannshausen genommen hätten.
Verlauf der mittelalterlichen Kupferstraße."
"64","68","DE","Umgehung der Geleite in Erfurt und Gotha, beschrieben in einem Bericht an den Geleitsmann in Guthmannshausen von 1515. 1522 heißt es bereits in der ""Acta die Landstraße von Weißensee nach Erfurt und die Sachsenburgische Straße betr. von 1522 - 72"" (M. st. A. Hep. A 24 b Tit. XXIV, Nr 11.), dass die Straße aufgrund des Straßenzwanges auf Erfurt brach lag."
"66","70","DE","Seit 1515 vertraglich festgelegte Zwangsstraße von Lübeck, Hamburg und Eisleben über den Harz nach Thüringen. In der ""Acta die Landstraße von Weißensee nach Erfurt und die Sachsenburgische Straße betr. von 1522 - 72"" (M. st. A. Hep. A 24 b Tit. XXIV, Nr 11.) wird die rechte Straße von Sachsenburg nach Sangerhausen über Ringleben beschrieben. Kurz vor dem Dreißigjährigen Krieg wurde der sächsische Teil der Straße gesperrt, was Verkehr nach Süddeutschland über Leipzig zwingen sollte. Durch den Krieg wurde diese Sperre jedoch kaum beachtet."
"68","72","DE","Die direkte Strecke zwischen Herbsleben und Gotha war seit 1515 diejenige die festgeschrieben war, wenn man auf direkten Wege nach Hessen fuhr, ohne den Thüringer Wald zu passieren. 1522 heißt es bereits in der ""Acta die Landstraße von Weißensee nach Erfurt und die Sachsenburgische Straße betr. von 1522 - 72"" (M. st. A. Hep. A 24 b Tit. XXIV, Nr 11.), dass die Straße aufgrund des Straßenzwanges auf Erfurt brach lag."
"70","74","DE","Gemäß einem Vertrag von 1515 musste wer aus dem Norden kam und den Harz passiert hatte und auf Crawinkel oder Tambach fuhr, Erfurt mit seiner Niederlage passieren."
"72","76","DE","Diese Strecke wurde befahren, um an den Geleiten Sangerhausen und Sachsenburg zu sparen, sowie um Erfurt zu umgehen. Das Geleit in Eisleben war günstiger und die Strecke verlief weiter über Tauhardt ins Weimarer Land, um von dort über den Thüringer Wald zu verlaufen. Ebenfalls Verlauf der mittelalterlichen Kupferstraße (Gräfenthalstraße/Saalfeldsche Straße/Querstraße/Kreuzweg)."
"74","78","DE","Das Umfahren der Sachsenburger und Weißenseer Geleite über Kutzleben und Gebesee auf Erfurt war Anfang des 16. Jahrhunderts ausschließlich Nordhäuser Fuhrmännern vorbehalten."
"76","80","DE","Da die Havel als Mühlgraben genutzt wurde, wurde der Schiffsverkehr durch den seit 1349 sogenannten Jakobsgraben geleitet. 1550 wurde er durch den Bau einer Kammerschleuse im Stadtkanal ergänzt."
"78","82","DE","1548-50 wurde eine Kammerschleuse im Brandenburger Stadtkanal angelegt, die den Schiffsverkehr durch den Jakobsgraben ergänzte. Der Ausbau des Kanals und der Schleuse begann bereits 1455, vermutlich im Zusammenhang mit dem Brandenburger Stapelrecht."
"80","84","DE","""Über den Berliner Mühlendamm hinweg existierte keine nennenswerte Schiffahrt"" (Schich 1994, 54)."
"82","86","DE","südliche Umgehungsstraße des Erfurter Geleits nach einem Erfurter Klageschreiben."
"84","88","DE","""Brücknerscher-"" oder ""Ur-Rennsteig"", bereits auf einer Karte von 1589 als ""Renstick"" bezeichnet, was die älteste Rennsteigbezeichnung auf einer Karte darstellt."
"86","90","DE","Moderner Rennsteig, 1830 vom gothaischen Offizier Julius von Plänckner festgelegt. Abschnitte sind bereits seit dem 14. und 15. Jahrhundert belegt. Ein Rennsteigbericht von 1597 bezeugt, dass spätestens zu diesem Zeitpunkt die Vorstellung eines Rennsteigs als ein zusammenhängender Höhenweg besteht."
"88","92","DE","Abschnitt des Rennsteiges, der bereits in einer Urkunde von 1330 in der Beschreibung des Frankensteiner Wildbannes namentlich genannt wird."
"90","94","DE","Rennsteigabschnitt, der bereits in Urkunden von 1039, 1143/44, 1227 und 1270 belegt ist, dort jedoch 'platea' genannt wird, womit eine Fahrstraße gemeint ist. Ebenfalls Nennung 1330 in der Beschreibung des Frankensteiner Wildbannes."
"92","96","DE","Stromelbe, einziger schiffbarer Elbarm bei Magdeburg. Wurde im Dreißigjährigen Krieg durch Pfahlwerke versperrt und versandete. Erst durch den Bau des Sperrdeichs ""Roste"" bis 1686 wurde die Elbe wieder in den westlichen Arm gezwungen."
"96","100","DE","Die Kammerschleuse in Calbe wurde 1564 erstmalig gebaut."
"98","102","DE","Die Kammerschleuse in Bernburg wurde 1560 erstmalig gebaut."
"100","104","DE","Die Kammerschleuse in Rothenburg wurde 1694 erneuert, was darauf hindeutet, dass sie bereits früher existierte."
"102","106","DE","Die Saale war zumindest seit 1700 lediglich ab Naumburg schiffbar; südlich von Naumburg wurde die Durchfahrt durch zu viele Mühlenwehre verhindert."
"104","108","DE","1150 Erwähnung einer ""strata publica"", die im Zusammenhang mit dem Klusdamm stehen dürfte. Die erste Erwähnung des Klusdammes selbst erfolgt 1479. Er wurde in den Folgejahren stets gut unterhalten, da es sich um eine zuverlässige, hochwasserfreie Passage der Elbniederung handelte."
"106","110","DE","Unterhalb Naumburgs wurde die Saale aufgrund der vielen Mühlenwehre im Mittelalter hauptsächlich für die Stammholzflößerei verwendet. Der Fluss wurde aber seit der Bronzezeit sicherlich mit Schiffen befahren."
"108","112","DE","Erster Hinweis auf Unstrutschifffahrt 1612, als dem Bürgermeister Sixtus Braun in einem Lehnbrief ein Erbschiff auf Saale und Unstrut gewährt wird. Es gab Pläne, die damalig sehr flache Unstrut und Gera in ihrer Schiffbarkeit zu verbessern, was jedoch durch den Kurfürsten von Sachsen verhindert wurde."
"110","114","DE","Die Weiße Elster hatte eine ausreichende Tiefe, um zumindest bis ins Hochmittelalter und bis zur Anlage entsprechender Mühlenwehre schiffbar zu sein. Für die Flößerei wurde sie sicherlich genutzt."
"112","116","DE","1579-87 wurde bei Krossen ein Floßgraben abgezweigt, um Brennholz zu den Salinen Teuditz und Kötzschau zu transportieren."
"114","118","DE","Im Register der Markgrafen von Meißen findet sich ein Eintrag, der sich auf eine Gebühr für die Schifffahrt auf der Pleiße bezieht; vermutlich handelte es sich um einen regelmäßigen Versorgungstransport aus der Umgebung für die Stadt Leipzig. Die Pleiße war vermutlich ab Rötha schiffbar."
"116","98","DE","Die Niederung der ""Langen wisch"" (langen Wiese) war erst ab ca. 1400 mittels eines Dammes zu durchqueren. Im 14. Jh. sind die Frachtwagen noch einen Umweg über Bodenstedt gefahren."
"118","120","DE","Die direkte Verbindung zwischen Braunschweig und Hannover über Peine wurde wahrscheinlich erst bedeutend nach der Erhebung Hannovers zur Residenz der Herzöge von Braunschweig-Lüneburg (1636). Der größte Teil des Verkehrs hat vorher wahrscheinlich den Umweg durch das Hochstift Hildesheim weiter südlich, oder nördlich über Burgdorf genommen."
"120","122","DE","Nach einem Gutachten aus 1688 war die Straße über Dömitz schwierig zu befahren in nassem Wetter, vor allem im Frühling und Herbst. Deswegen benutzten Wagen in solchen Fällen die Straße über die Mühle Findenwirunshier, wo dann der normalerweise zu Dömitz zu entrichtende Zoll erhoben wurde."
"122","124","DE","Der Hauptverkehr zwischen Wildeshausen und Bremen wird seit einem Abkommen zwischen der Stadt Bremen und dem Grafen von Delmenhorst aus 1311 über Delmenhorst verlaufen sein. Teilweise wurden Fuhrleute in Varrel gezwungen, über Delmenhorst zu reisen. Jedoch erklärten noch 1652 Wildeshausener Fuhrleute, dass die gemeine Heer- und Handelsstraße nach Bremen über Horstedt und Varrel verlief."
"124","126","DE","Der schwerere Verkehr nahm wegen der sumpfigen Gegend den Umweg über Kirch- und Sandhatten. Der frühneuzeitliche Postweg umging diese Orte weiter nördlich."
"126","128","DE","Die ursprüngliche Straße um das Zwischenahner Meer nahm die nördliche Route. Die direktere aber auch schwierigere südliche Route ist im 17. Jh. als Haupstraße belegt."
"128","130","DE","Um Apen waren die Straße in schlechtem Zustand und oft überschwemmt. Der Warenverkehr zwischen Bremen und Ostfriesland benutzte deswegen oft die Wasserwege."
"130","132","DE","Diese Reiseroute ist mehrfach für Martin Luther belegt, der von Wittenberg entweder über Eilenburg nach Borna oder über Torgau – Grimma nach Borna reiste. Er musste sich dabei an territorialpolitischen Bedingungen orientieren, in diesem Fall der Verlauf der ernestinischen Territorialgrenzen ca. 1485 - 1547."
"132","134","DE","1489 wird der Fiener Damm an der schmalsten Stelle des Fiener Bruchs instand gesetzt, wodurch der Verkehr auf der Strecke Magdeburg - Berlin sich nun zunehmend über Ziesar verlegte."
"134","136","DE","Der Verlauf der Straße von Erfurt nach Weißensee über Stotternheim, Alpenstedt, Haßleben und Wundersleben ist in der ""Acta die Landstraße von Weißensee nach Erfurt und die Sachsenburgische Straße betr. von 1522 - 72"" (M. st. A. Hep. A 24 b Tit. XXIV, Nr 11.) beschrieben."
"136","138","DE","In den Geleitssachen von Artern von 1661 heißt es, dass die Straße zwischen Artern und Reinsdorf, die aus mehreren Brücken, Dämmen, Gräben und Pflastern bestand, um die Unstrutniederung zu überqueren, schwer im 30-jährigen Krieg beschädigt wurde."
"138","140","DE","Die Straße von Schönwerda nach Allstedt wurde nach 1580 aus Rücksicht vor der Saline in Artern endgültig über Artern verlegt. Ein Straßendamm für die Direktverbindung zwsichen Allstedt und Artern wurde eingerichtet."
"140","142","DE","Dieser Abschnitt der Via regia ist als direkte Anbindung Naumburgs erst mit dem Brückenbau in Kösen 1393 möglich geworden."
"142","144","DE","Dieser Abschnitt der Straße wird erst ab 1560 bedeutend, als sie für den Vekehr von den Niederlanden über Mühlhausen nach Leipzig freigegeben wird und verliert zum 19. Jahrhundert wieder an Relevanz."
"144","146","DE","Die Bedeutung dieser Straße geht möglicherweise bis ins Frühmittelalter zurück; Heinrich I. reiste auf ihr mit seiner Braut von Herford nach Wallhausen. Später gewann sie wieder mit den aufsteigenden Handelszentren Antwerpen und Leipzig an Bedeutung. Wichtig für ihre Stellung war die direkte Linie in das Wipper-Leinetal, woduch eine direkte Verbindung nach Hessen und Westdeutschland möglich wurde. Sie führte deshalb unter anderem die Namen ""Leipziger Straße"", ""ordentliche Land- und Heerstraße vom Harz, Eichsfeld und Nordhausen her nach Leipzig und Naumburg"", sowie ""Haupt-Rhein-Straße""."
"146","148","DE","Der Verkehrsweg durch das Unstruttal wurde vermutlich nur selten genutzt, obwohl lediglich der Abschnitt zwischen Memleben und Nebra geographisch ungünstig war. Vermutlich handelte es sich bei der Nordwest-Südost-Ausrichtung im Mittelalter nicht um eine häufig genutzte Richtung."
"148","150","DE","Seit 1515 handelte es sich hier um die rechte Straße von Nürnberg nach Erfurt. Ab Gehren hatte man die Wahl den Verlauf über Langewiesen - Ilmenau zu nehmen oder über Gräfinau."
"150","152","DE","Diese Verbindung zwischen Nordhausen und Sondershausen kam vermutlich erst im 17. und 18. Jahrhundert auf. Sie findet sich erst in einer Karte von 1750, wo sie als Land- und Poststraße bezeichnet wird, während weiter westliche die Straße über Rüxleben als ""gemeine Straße"" bezeichnet wird."
"152","154","DE","Diese Straße wurde 1683 als die rechte Straße von Nürnberg nach Leipzig bestimmt."
"154","156","DE","1470 wurde die Strecke von Hof auf Schleiz für den Handel nach Leipzig verboten und nur der Erfurter Handel durfte weiterhin auf dieser Strecke fahren. Der Verkehr auf Leipzig hatte über Plauen oder Oelsnitz zu fahren. Anscheinend benötigte dieses Gebot der mehrfachten Erinnerung; noch 1551 wird auf die rechte Straße verwiesen."
"156","158","DE","1433 und 1459 wurde verfügt, dass der Verkehr zwischen Brandenburg und Magdeburg über Plaue zu laufen hatte, wo der entsprechende Zoll geleistet werden musste. Mit der Instandsetzung des Fiener Damms verlegte sich der Verkehr zunehmend über Ziesar, wodurch diese Route verödete."
"158","160","DE","Die am Fuß des Harzes entlangziehende Talzone wurde durch den Verkehr wahrscheinlich erst ab dem 17. Jh. benutzt. Vorher zog der Verkehr zwischen Osterode und Herzberg über die Höhen weiter östlich."
"160","162","DE","Seit 1515 vertraglich festgelegte Zwangsstraße von Lübeck, Hamburg und Eisleben über den Harz nach Thüringen. In einen Bericht nach Guthmannshausen heißt es, dass die Waren von Lübeck, Braunschweig und Magdeburg nach Franken jeher die Straße über Nebra, Tauhardt und Guthmannshausen genommen hätten."
"162","164","DE","Die direkte Straße zwischen Schladen und Wiedelah/Vienenburg wird in Quellen aus dem 18. Jh. erwähnt; ihre Bedeutung für frühere Jahrhunderte ist zweifelhaft."
"164","166","DE","Die Oker wurde 1575 zwischen Schladen und Wolfenbüttel schiffbar gemacht, und 1577 zwischen Schladen und Oker, unter anderem durch Schleusenbau. Die Schiffbarmachung war eng mit dem Ausbau Wolfenbüttels als Festungstadt durch die Herzöge von Braunschweig verbunden, und der Fluss diente hauptsächlich dem Transport von Steinen und Bauholz für die Bauaktivitäten in der Stadt. Die Schifffahrt auf der Oker kam zum Stillstand im Dreißigjährigen Krieg."
"166","168","DE","Die Nette (Altenau) wurde 1575 schiffbar gemacht, hauptsächlich für den Transport von Steinen aus dem Elm die für den Ausbau Wolfenbüttels zur Festungstadt durch die Herzöge von Braunschweig benötigt waren. Einem Bericht aus 1578 zufolge war die Nette bis Schöppenstedt schiffbar. Wegen der geringen Tiefe des Stromes ist es jedoch sehr fragwürdig ob der Fluss viel genutzt wurde; um 1610 muss die Schifffahrt auf der Nette jedenfalls eingegangen sein."
"168","170","DE","Obwohl möglich bereits im Hochmittelalter Schifffahrt auf der Oker in Braunschweig stattfand, war sie im 14. Jh. wegen Stapelansprüche Lüneburgs zum Stillstand gekommen. 1459 wurde Schifffahrt auf der Oker und Aller zwischen Braunschweig und Celle offiziell erlaubt, ausgenommen Transporte von Salz, Eisen und Trockenfisch. Sie wurde zudem gefördert durch Bauarbeiten an Schleusen und im Flussbett in den nächsten Jahren. Die Schifffahrt auf dieser Strecke blühte einige Jahrzehnten, aber muss vor 1507 zum Stillstand gekommen sein, als festgestellt wurde, dass die Celler Zolleinkünfte von Braunschweiger Schiffen weggefallen waren."
"170","172","DE","Die Leine wurde spätestens 1381 als Schifffahrtsweg nach Hannover geöffnet, nach dem Lüneburger Erbfolgekrieg und einer Fehde mit der Familie Mandelsloh, die viel Land am Fluss besaß. Vereinbarung mit Mühlen- und Fischwehrbesitzern garantierten die Vorbeifahrt der Wehre. Die Leineschifffahrt führte zu Konflikten mit Lüneburg und Celle wegen der Stapel- und Zollansprüche. Ein Vertrag auf 10 Jahre aus 1507 regelte die Zollabgaben der Leineschifffahrt der Hannoveraner, aber er wurde nachher nicht erneuert und die Schifffahrt wurde eingestellt."
"172","176","DE","Das Ilmenauprivileg 1348 erlaubte der Stadt Lüneburg, das Flussbett der Ilmenau stromaufwärts aufzuräumen und den Fluss somit schiffbar zu machen. Er wurde hauptsächlich als Transportweg für Brennholz für die Lüneburger Saline benutzt. Laut einer Quelle aus 1393 hatten die Herzöge von Braunschweig-Lüneburg zu der Zeit die Ilmenau versperrt. Ab 1562 wurde auf die Strecke zwischen Medingen und Uelzen verzichtet."
"174","178","DE","Die Stadt Hamburg versuchte die freie Schifffahrt auf dem südlichen Elbarm ab dem späten 14. Jh. zu verhindern, zum Schutz ihres Stapels. Ab der Erwerbung der Moorburg 1375 war die Stadt in der Lage, Schiffe anzuhalten und zu zwingen nach Hamburg zu fahren, trotz eines Konflikte mit den Herzögen von Braunschweig-Lüneburg und den Städten Harburg, Stade und Buxtehude, und eines Urteils des Reichskammergerichts aus 1619, dass die Schifffahrt auf der Süderelbe frei sein sollte."
"176","180","DE","Einer Urkunde aus 1033 zufolge war die Ruhr bis zur Abtei Werden schiffbar. Obwohl Schifffahrt im Ruhrrecht 1542 nicht genannt wird, werden Ruhrkähne in der Hafenordnung aus Wesel 1681 erwähnt. Dies deutet darauf hin, dass zumindest der Unterlauf des Flusses durch die Jahrhunderte schiffbar geblieben ist."
"178","182","DE","1390 schlossen der Lübecker Rat und der Herzog von Sachsen-Lauenburg einen Vertrag über das Graben eines Kanals zwischen Mölln und der Delvenau, die bei Lauenburg in die Elbe mündet. Bis 1398 wurde südlich von Mölln ein Kanal von etwa 11km gegraben, die Delvenau kanalisiert sowie mehrere Schleusen angelegt. Der resultierende sogenannte Stecknitzkanal wurde hauptsächlich für Salztransporte zwischen Lüneburg und Lübeck benutzt."
"180","184","DE","Hamburg erlangte 1448 die Erlaubnis, einen Kanal zwischen der Alster in Stegen und der Beste/Trave in Sülfeld zu bauen und damit eine durchgehende Wasserstraße nach Lübeck zu erschaffen. Das Projekt wurde jedoch erst 1529 ausgeführt, und trotz vieler Schleusen gab es ständig Probleme, genügend Wasser im Kanal zu halten. Die Schifffahrt auf dem Kanal wurde etwa 20 Jahre nach der Eröffnung wieder eingestellt."
"182","186","DE","Die Benutzung der Landstraßen von Harburg und Winsen südwärts, Lüneburg umgehend, war den Lüneburger Stapelprivilegien aus 1392 gemäß für den Warentransport untersagt sowie ab 1467 für die Viehtrift. Es war jedoch für die Stadt nicht immer möglich, diesen Straßenzwang auch durchzusetzen."
"184","188","DE","Die Ems wurde zwischen Rheine und Greven schiffbar nach der Erbauung eines Mühlenwehrs in Rheine 1550. Versuche die Ems auch flussaufwärts von Greven schiffbar zu machen im 17. Jh. scheiterten wegen des geringen Wasserstandes."
"186","190","DE","Die Ems war bis Meppen für größere Schiffe befahrbar; bis Rheine oder Greven nur mit kleineren Schiffen oder Flößen oder beim mittleren Wasserstand."
"188","192","DE","Um 1480 versuchten die Herzöge von Mecklenburg, eine Wasserstraße zwischen der Elbe und der Ostsee durch den Schweriner See und die Flüsse Stör und Elde einzurichten. Die Bemühungen scheiterten hauptsächlich wegen Wiederstand des Kurfürsten von Brandenburg. Erneute Bemühungen ab 1564 führten zu einem Kanalbau von Dömitz nach Eldena zwischen 1568 und 1572, die Mark Brandenburg umgehend, womit die Wasserstraße zwischen Dömitz und den Schweriner See schiffbar wurde. Die Verbindung zwischen den Schweriner See und Wismar machte aber größere technische Schwierigkeiten und war wahrscheinlich nie betriebsfähig, trotz der Darstellung des Kanals als durchgehender Wasserweg auf einer Karte von Daniel Frese aus 1605."
"190","194","DE","1412 and 1430 erhielt Lüneburg Privilegien, Wasserwege durch Mecklenburg anzulegen für den Transport ihres Salzes zu den Ostseehäfen. Zwischen 1553 und 1564 wurde dann die Schaale schiffbar gemacht, unter anderem durch den Bau von sieben Schleusen. Damit wurde eine schiffbare Verbindung zwischen der Elbe bei Boizenburg und dem Schaalsee geschaffen. In Dutzow am Nordufer des Sees wurden die Güter auf die Landstraße zu den Hafenstädten umgeschlagen."
"192","196","DE","Der Graf von Delmenhorst und die Stadt Bremen verpflichteten sich 1311 beiderseits zur Unterhaltung der Straße zwischen Bremen und Delmenhorst über Huchting. Ältere Routen, nördlich über Seehausen und Hasbergen oder südlich über Ganderkesee, wurden nun durch Delmenhorst geleitet. Wegen der Lage in einer Niederung war die neue Straße jedoch oft überschwemmt; in solchen Fällen wurden die alten Straßen wieder benutzt und boten die Einwohner von Huchting Fährdienste an."
"194","198","DE","In einem Vertrag zwischen Mainz und Hessen von 1572 wird diese Straße von Wanfried nach Langensalza als neue Straße und keine offene Landstraße bezeichnet. 1583 wird sie zur Geleitsstraße erhoben."
"196","202","DE","Kurz vor 1600 begann Landgraf Moritz von Hessen-Kassel mit Baumaßnahmen zur Schiffbarmachung der Fulda, unter anderem mittels der Errichtung von sieben Schleusen. Das erste Schiff aus Kassel erreichte 1601 Hersfeld. Es ist jedoch die Frage in wieweit der Fluss als Schifffahrtsverbindung benutzt wurde; spätestens im Dreißigjährigen Krieg muss hier die Schifffahrt eingegangen sein."
"198","204","DE","Diese Straße wurde vermutlich bereits 1027 in einer Grenzbeschreibung erwähnt, 1227 kommt sie unter dem Namen Weinstraße vor."
"200","206","DE","Eine Urkunde von 1330 benennt diesen Straßenabschnitt mit ""Hohe Straße""."
