"ID","Comments_ID","Language","Description"
"202","218","NL","Meijel bevond zich op een zandrug door het hoogveengebied De Peel, dat verder nauwelijks toegankelijk was. Een route over deze zandrug is waarschijnlijk terug te voeren in de Romeinse tijd, zoals archeologische vondsten aantonen. In de 18e eeuw wordt hier een doorgaande weg tussen 's-Hertogenbosch en Keulen genoemd, wat door het bestaan van een tol en herbergen in Meijel wordt ondersteund. Het venige gebied moet de doorgang echter regelmatig bemoeilijkt hebben. Volgens de Engelse militair D. Paterson in 1748 was de weg ""impassable in winter for wagons of any size"". Hoogstens ging het hier dus om een verbinding van secundair belang, waarbij het meeste doorgangsverkeer de Peel zal hebben gemeden."
"204","220","DE","Die Straße auf dem linken Lippeufer zwischen Hamm und Lünen war sehr sumpfig und wurde wahrscheinlich erst nach dem Dreißigjährigen Krieg für den Fernverkehr genutzt."
"206","222","DE","Im Mitteldeutschen Heimatatlas als Nebenstrecke vor dem 15. Jahrhundert eingezeichnet."
"208","224","DE","Vor dem Bau der Brücken in Berka/Werra wurde teilweise eine Strecke entlang der Werra mit einer Furt in Wartha genutzt. Die Furt war allerdings beschwerlich und unmittelbar danach musste eine Geländezunge erklommen werden, die erst im 19. Jahrhundert abgetragen wurde."
"212","226","NL","Met de bouw van een grote schutsluis in Zaandam, die gereed kwam in 1547, werd de Zaan de hoofdwaterweg tussen Amsterdam en het Hollandse noorderkwartier. Voorheen was de dam alleen door kleine schuiten te passeren en verliep de vaarroute voor grotere schepen tussen Alkmaar en Amsterdam met een omweg via Edam."
"214","228","NL","Nadat de Hollandse IJssel van de Lek was afgedamd in 1285, verlandde de rivier langzaam. In 1486 werd opgemerkt dat de rivier tussen IJsselstein en Oudewater daardoor al lang onbevaarbaar geworden was."
"216","230","NL","De trekvaart tussen Amsterdam en Haarlem werd in 1631-1632 gegraven. Op wens van Haarlem, dat een tol hief op het Spaarne, was het gebruik van het kanaal beperkt tot personenvervoer; voor vrachtvervoer bleef de oude route via het IJ en het Spaarne in gebruik. Vanwege de aanwezigheid van drie spuisluizen in Halfweg was het kanaal daar onderbroken en moesten passagiers overstappen op een andere trekschuit."
"218","232","DE","Die südliche Route zwischen Lüneburg und Soltau über Amelinghausen war die ältere und wurde später als Karrenweg bekannt; der stärkere Verkehr mit Frachtwagen benutzte ab dem 15. Jh. die nördliche Route über Soderstorf und Hützel."
"220","234","DE","Die nördliche Route zwischen Lüneburg und Soltau über Soderstorf und Hützel entwickelte sich im späten 15. oder 16. Jh. für den schweren Frachtverkehr. Sie war später als Fracht- und Postweg bekannt."
"222","236","DE","Nach Bruno Ploetz war die Straße zwischen Lüneburg und Celle über Tellmer und Oberohe der alte Karrenweg. Er verödete im 18. Jh. langsam wegen Bevorzugung des Frachtweges über Müden."
"224","238","DE","Nach Bruno Ploetz entstand der Frachtweg zwischen Lüneburg und Celle über Müden im 16. Jh. und ersetzte langsam den älteren Karrenweg über Tellmer und Oberohe."
"226","240","DE","Der ""Hessenkarrenweg"" war die Route für den Karrenverkehr zwischen Braunschweig und Lüneburg. Ein Frachtweg für Frachtwagen verlief auf manchen Strecken östlich dieser Route."
"228","242","DE","Der Frachtweg für schwere Frachtwagen zwischen Braunschweig und Lüneburg verlief östlich des Hessenkarrenweges an manchen Teilen der Route."
"230","244","DE","Die Strecke zwischen Bienenbüttel und Oldenstadt/Uelzen über Medingen und Jastorf war als Winter-Frachtweg bekannt, weil sie in Gegensatz zu dem westlicher gelegenen Sommerweg zu allen Jahreszeiten benutzt werden konnte."
"232","246","DE","Die Straße zwischen Bienenbüttel und Uelzen über Seedorf war als Sommer-Frachtweg bekannt, weil sie nur bei trockenem Wetter benutzt werden konnte, in Gegensatz zu dem Winterweg über Jastorf."
"234","248","NL","In 1640 verkregen de steden Leeuwarden, Franeker en Harlingen een octrooi om langs de reeds bestaande vaarten tussen de drie steden een trekpad aan te leggen. In 1646 verkeerde de eerste trekschuiten op deze route; dagelijks waren het er vijf in beide richtingen. Passagiers betaalden 12 penningen per afgelegde mijl, voor voetgangers gold een tol van acht penningen de mijl."
"236","250","NL","In 1648 werd een trekvaart tussen Leeuwarden, Bolsward en Workum aangelegd."
"238","252","NL","De vaarroute tussen Dokkum en Leeuwarden werd in 1647 tot trekvaart met een trekpad uitgebouwd."
"240","254","NL","Het Damsterdiep tussen Groningen en Delfzijl werd in 1648-1650 tot trekvaart omgebouwd."
"242","256","NL","Op Jacob van Deventer's kaart van Sloten (midden 16e eeuw) wordt de weg naar het noordoosten richting Sint Nicolaasga slechts weergegeven als voetpad. Op kaarten uit het midden van de 17e eeuw wordt wel de huidige Spanjaardsdijk als rijweg ingetekend."
"244","258","DE","Von Schifffahrt auf der Oude IJssel ist keine Rede vor dem Jahr 1582, als die Wassermühle bei Keppel, die vorher der Schifffahrt behindert hatte, zerstört wurde. Einer Hafenordnung aus Doesburg 1590 zufolge, fuhren zu der Zeit Schiffe zwischen Doesburg und Doetinchem. 1592 wurden zudem die Bocholter Aa bis Bocholt und die Issel bis Anholt schiffbar gemacht."
"246","258","NL","Van scheepvaart op de Oude IJssel was waarschijnlijk vóór 1582 geen sprake; in dat jaar werd de watermolen bij Keppel, een obstakel voor de scheepvaart, afgebroken. Uit een ordonnantie uit Doesburg uit 1590 blijkt, dat toen scheepvaart tussen Doesburg en Doetinchem plaatsvond. Vanaf 1592 vonden bovendien werkzaamheden plaats om de rivier tot aan Bocholt (Bocholter Aa/Aastrang) en Anholt (Issel) bevaarbaar te maken."
"248","260","NL","Na de Elizabethvloed (1421) was de waterhuishouding in de Hollandse Rijndelta zo grondig veranderd, dat de IJssel langzaam steeds ondieper werd. In de late 16e en 17e eeuw was de rivier zelfs zo ondiep geworden, dat de vele zandbanken en de lage waterstand scheepvaart gedurende grote delen van het jaar onmogelijk maakten."
"250","262","NL","Op de heide tussen Utrecht en Amersfoort werd in 1652 een kaarsrechte, 60m brede nieuwe weg aangelegd: de ""wegh der weegen"". Er schijnt op deze plaats ook een middeleeuwse route te zijn geweest, waarvan het verloop niet meer is vast te stellen."

