"ID","Nodes_ID","Name","Continuation_From_ID","From","To","Description","Category","Date","Fixed_Day","Fixed_Month","Weekday","Before_After","Date_Depends_On","Start_Max","Start_Min","End_Min","End_Max"
"644","8752","","","1484","","Bishop Dietrich grants the town a fair in 1484. It begins at St. Vitri's and is supposed to last 4 days.","regional","fixed","15","6","","","","","","4",""
"646","8752","","","1593","1600","Chapter administrator duke August grants another market to the town in 1593, which is set to the Tuesday after Jacobi in 1601.","local","movable","25","7","Tuesday","after","Fixed date","","","",""
"648","1737","","","1300","","Fair at St. George's Church on Letare Sunday.","local","movable","","","","","Letare","","","",""
"650","1737","","","1300","","Fair at Our Lady's Church on St John's Day.","local","fixed","24","6","","","","","","",""
"652","1737","","","1300","","Fair at St Nicholas's Church on St Matthew's Day.","local","fixed","21","9","","","","","","",""
"654","10265","","","1413","","The first mention of the market in Ringsted, held at Skt. Hans day (23. june), from 1413, mentions it as a horse market. The market was also held at harvest at Vor Frue Dag (8. sept.).","local","fixed","23","6","","","","","","",""
"656","10265","","","1413","","The first mention of the market in Ringsted, held at Skt. Hans day (23. june), from 1413, mentions it as a horse market. The market was also held at harvest at Vor Frue Dag (8. sept.).","local","fixed","8","9","","","","","","",""
"658","8853","Saint Walpurgis fair","","1294","","The Saint Walpurgis fair is also known as the May market. This is the only fair in Guelders with, to a limited extent, a supraregional function. At least from the early sixteenth century onwards, it was primarily an oxen fair. ","regional","fixed","1","5","","","","","","7",""
"660","8853","","","1316","","This fair took place around Saint Bartholomew's Day. The privileges for this fair were granted 1316 by Count Reginald I of Guelders. The fair functioned at least until 1543. ","regional","fixed","24","8","","","","","-7","7",""
"662","8853","","","1420","","This fair took place eight days before the day before the feast day of Saint Vitus and Saint Modestus. The rights were given by duke Reginald IV of Guelders in 1420. The creation of this fair and another one in the same year was motivated by the worsening of the town’s trading position. Over a period of ten years, in combination with staple rights on goods transported from Lochem to Zutphen over the Berkel river, this ducal gesture had a positive effect on market trade in Zutphen.","local","fixed","6","6","","","","","","",""
"664","8853","","","1420","","This fair took place eight days before the day before All Saints' Day. The rights were given by duke Reginald IV of Guelders in 1420. The creation of this fair and another one in the same year was motivated by the worsening of the town’s trading position. Over a period of ten years, in combination with staple rights on goods transported from Lochem to Zutphen over the Berkel river, this ducal gesture had a positive effect on market trade in Zutphen.","local","fixed","23","10","","","","","","",""
"666","8853","","","1464","","This fair took place on the day of the Birth of Saint John. Indirect testimonies show that the rights to hold this fair were given to Zutphen in 1464/1465, together with the rights for three other fairs. No documents of these grants have been saved; it is uncertain if they have ever been actually issued. The fair took place at the same day as a fair in Deventer, and it's institution is probably related to a trade war between Deventer and towns in Holland. ","regional","fixed","24","6","","","","","","",""
"668","8853","","","1464","","This fair took place on Saint James' Day. Indirect testimonies show that the rights to hold this fair were given to Zutphen in 1464/1465, together with the rights for three other fairs. No documents of these grants have been saved; it is uncertain if they have ever been actually issued. The fair took place at the same day as a fair in Deventer, and it's institution is probably related to a trade war between Deventer and towns in Holland. ","local","fixed","25","7","","","","","","",""
"670","8853","","","1464","","This fair took place on Saint Michael's Day. Indirect testimonies show that the rights to hold this fair were given to Zutphen in 1464/1465, together with the rights for three other fairs. No documents of these grants have been saved; it is uncertain if they have ever been actually issued. The fair took place at the same day as a fair in Zwolle. It's institution is probably related to a trade war between Deventer and towns in Holland. ","regional","fixed","29","9","","","","","","",""
"672","8853","","","1464","","This fair took place on Saint Martin's Day or Saint Lebuinus' Day. Indirect testimonies show that the rights to hold this fair were given to Zutphen in 1464/1465, together with the rights for three other fairs. No documents of these grants have been saved; it is uncertain if they have ever been actually issued. It's institution is probably related to a trade war between Deventer and towns in Holland. ","regional","fixed","11","11","","","","","","","1"
"674","8853","","","1522","","This fair took place at Saint Gregory's Day. The rights for this fair were granted by Charles, duke of Guelders, in 1522. ","regional","fixed","12","3","","","","","","",""
"676","186","","","1419","","Altenburg receives an eight-day fair from rogation sunday until exaudi from margrave Wilhelm.","regional","movable","","","","","Vocem","","","8",""
"680","8763","","","1487","1501","Fair on St Bartholomew.","regional","fixed","24","8","","","","","","3",""
"682","8763","","","1487","1545","Fair on St Dionysius.","local","fixed","9","10","","","","","","",""
"684","8763","","682","1546","","Fair on St Ursula","local","fixed","6","10","","","","","","",""
"686","10532","","","","","Cattle market on John Baptiste","local","fixed","24","6","","","","","","",""
"688","10532","","","1479","","Cattle market on St. Michael's day","local","fixed","29","9","","","","","","",""
"690","10532","","","1479","","Cattle market on All Saint's day.","local","fixed","1","11","","","","","","",""
"692","186","","","1437","","In 1437, Altenburg has a fair on the day of the nativity of Mary. It is not clear whether it was held on the same day every year.","local","fixed","8","9","","","","","","",""
"694","1257","","","1535","","Fair during the rogation days.","local","movable","","","Wednesday","before","Ascension","","","",""
"696","1257","","","","","Fair on St. Gallus' day.","local","fixed","16","10","","","","","","",""
"698","4850","Michaelismarkt","","933","","Michaelismarket, already held around the foundation of the city.","local","fixed","29","9","","","","","","3",""
"700","4850","Baschemarkt","","","","Fair on the day of St. Fabian and Sebastian.","local","fixed","20","1","","","","","","",""
"702","4850","Martinijahrmarkt","","1007","1683","Fair on St. Martin's day to commemorate the consecration of St. Martin's church.","local","fixed","11","11","","","","","","",""
"704","4850","Klostermarkt","","1242","","Cloister-market or Brüder-Kirchweih-market","local","movable","","","","","Cantate","","","",""
"706","4850","Kapitelmarkt/Sensenmarkt","","1278","1902","Fair to commemorate the second consecration of the parish church, held until today (?) in the third week after Pentecost on the second Trinitatis sunday.","local","movable","","","","after","Pentecost","","","",""
"708","4850","Kirchweih-Jahrmarkt","","1336","1550","Consecration-fair","local","movable","","","","","Quasimodo","","-1","1",""
"710","4850","Burkhardi-Jahrmarkt/Zwickmarkt","","1344","","Fair for the commemoration of the bestowal of town rights to Meiningen by emperor Ludwig the Bavarian.","local","fixed","","","","","","","","",""
"712","4850","Maria-Magdalenenmarkt/Kirschenmarkt","","1384","","Fair for the commemoration of the consecration of a chapel built on the remains of the synagogue, which had been razed in 1349.","local","fixed","22","7","","","","","","",""
"714","4850","","","1612","","Horsemarket, moved to Tuesday after Invocavit later and held as a regular fair until the 20th century.","local","movable","","","Monday","after","Reminiscere","","","",""
"718","5972","","","1532","","fair on Johannis Baptista","local","fixed","24","6","","","","","","",""
"720","4337","","234","1466","","Extension of the New Year's market by princely electorate Friedrich III. by two days. The market was eight days long now. In 1497 the fair was confirmed by Maximilian I. (who hadn't been crowned emperor at this point!) including safe conduct of three weeks, in 1507 extended by a ban zone ('Bannmeile') of 15 miles and a staple.","regional","fixed","","","","","","","","8",""
"722","8274","","","","1581","Fair was held on St. Peter and Paul's day","local","fixed","29","6","","","","","","",""
"724","8274","","722","1582","1863","In 1582, duke August of Saxony grants Weißensee a horsemarket and fair on Laetare Sunday and the following Monday","local","movable","","","","","Letare","","","1",""
"726","8274","","","","1863","Fair on the second Sunday after St. Margaret","local","movable","13","7","Sunday","after","Fixed date","","","",""
"728","8274","","","","1863","Fair on the third Sunday after St. Gallus'","local","movable","16","10","Sunday","after","Fixed date","","","",""
"730","9616","","","1390","","Sunday before the Ascension of St Mary","local","movable","15","8","Sunday","before","Fixed date","","","",""
"732","9616","","","1390","","Sunday before St Martin","local","movable","11","11","Sunday","before","Fixed date","","","",""
"734","10947","","","1613","","Fair on St Simon and Jude","local","fixed","28","10","","","","","","",""
"736","11020","","","1541","","Three-day fair on eight days before St Vitus","local","fixed","8","6","","","","","","2",""
"738","11020","","","1541","","Three-day fair on eight days before St Michael, to which a cattle market was connected.","local","fixed","22","9","","","","","","2",""
"740","11020","","","1570","","Horse fair on the Dispersion of the Apostles","local","fixed","15","7","","","","","","",""
"742","1484","St. Gallus","","1294","","At least since 1294/95 until at least 1543, a fair took place on St. Gallus Day (16 October). ","regional","fixed","16","10","","","","","","",""
"744","1484","","","1340","1495","In 1340, a fair is being granted by Reginald (Reinald) I, count of Guelders and Zutphen. It lasts eight days from Wednesday before St. Margaret's Day onward. In 1496, Charles, duke of Guelders, grants permission to the town magistrate of Doesburg to shift the fair to 21 April (St. George's Day). This might have had to do with a fair granted in 1364/65 to Zutphen, which took place in July as well. ","regional","movable","13","7","Wednesday","before","Fixed date","","","7",""
"746","1484","","744","1496","","In 1340, a fair is being granted by Reginald (Reinald) I, count of Guelders and Zutphen. It lasts eight days from Wednesday before St. Margaret's Day onward. In 1496, Charles, duke of Guelders, grants permission to the town magistrate of Doesburg to shift the fair to 21 April (St. George's Day). This might have had to do with a fair granted in 1364/65 to Zutphen, which took place in July as well. ","regional","fixed","21","4","","","","","","7",""
"748","1485","","","1294","","Doetinchem had at least since 1294/95 a fair on St. Catharine’s Day (25 November). The duration of this fair is unknown.","local","fixed","25","11","","","","","","",""
"750","11044","","","1500","","Eight-day fair on St Vitus, which goes back to Catholic times. Important was the market with wood and timber, which lasted often up to 14 days. Because the wood was transported over the water, the fair took place outside of the dikes.","local","fixed","15","6","","","","","","7","13"
"752","11045","","","1588","1619","Three-day fair on Sunday Cantate. In 1620, it is not mentioned any more.","local","movable","","","","","Cantate","","","2",""
"754","11045","","","1588","1619","Three-day fair on Sunday after St Bartholomew. In 1620, it is not mentioned any more.","local","movable","24","8","Sunday","after","Fixed date","","","2",""
"756","11045","","","1620","","Fair on Sunday after St George","local","movable","23","4","Sunday","after","Fixed date","","","",""
"758","11045","","","1620","","Fair on Sunday after Trinity Sunday","local","movable","","","Sunday","after","Trinitatis","","","",""
"760","11045","","","1620","","Fair on Sunday before All Saints' Day","local","movable","1","11","Sunday","before","Fixed date","","","",""
"762","11047","","","1588","","Fair for commodities and wood on Tuesday before St Michael. First attested in 1724, but probably granted around 1588.","local","movable","29","9","Tuesday","before","Fixed date","","","",""
"764","11055","","","1588","","Fair on the second Sunday before St Michael","local","movable","22","9","Sunday","before","Fixed date","","","",""
"766","11050","","","1632","","Fair on Thursday after Easter. In 1640 indicated with a duration of 14 days.","local","movable","","","Thursday","after","Easter","","","13",""
"768","8763","","680","1502","","The Bartholomew fair is prolonged by 2 days from 3 to 5 by emperor Maximilian in 1502.","local","fixed","24","8","","","","","","5",""
"770","1741","","","1521","1690","This fair was established on St. Veit's day in 1521. Even though Leipzig protested and was boycotted by duke Georg of Sachsen, it was held in the years 1521, 1583, 1617, 1619, 1637, 1660 and 1690.","local","fixed","15","6","","","","","","",""
"772","1741","","","1422","","Fair on Sunday after Mauritius' day","local","fixed","22","9","","","Vocem","","","",""
"774","1741","","","1422","","Fair on Reminiscere","local","movable","","","","","Reminiscere","","","",""
"776","1741","","","1422","","Fair on sunday after St. Gallus' day","local","fixed","16","10","","","","","","",""
"778","848","","","1637","","Fair on Sunday after St. Margaret's day.","local","movable","13","7","Sunday","after","Fixed date","","","",""
"780","3455","","","1556","","In 1556 the cattle market and fair was to be moved from 8 days before St. Laurentius' day to the thursday after St. Laurentius' day.","local","movable","10","8","Thursday","after","Fixed date","","","",""
"782","8655","","","1558","1558","In 1558 the council of Wurzen proclaimed to hold a fair, which had been granted by the bishop of Meißen. Leipzig protested and electorate prince August commanded the bishop of Meißen to cancel the fair.","local","fixed","","","","","","","","",""
"788","10767","","","1609","","In 1609 electoral prince Christian II. granted two new fairs to Wahrenbrück, one day before the fair a cattle market and a day before that a general market was to be held.","local","fixed","23","6","","","","","-2","",""
"790","10767","","","1609","","In 1609 electoral prince Christian II. granted two new fairs to Wahrenbrück, one day before the fair a cattle market and a day before that a general market was to be held. This fair was to be held on Sunday after St. Lucia's day.","local","fixed","13","12","","","","","-2","",""
"792","4222","","","1612","","Leipzig accepted this fair in Landsberg after it had assured that it wouldn't move against Leipzig's fair or staple privileges.","local","fixed","","","","","","","","",""
"794","961","","","1624","","Fair on Sunday before Simonis and Judae.","local","fixed","28","10","","","","","","",""
"796","961","","","1624","","Fair on Judica Sunday","local","movable","","","","","Judica","","","",""
"798","6200","","","1628","1650","Fair on the Eselstedter meadow at Querfurt. It stopped during the 30-year war.","local","movable","","","Thursday","after","Easter","","","",""
"800","8862","","","1630","","Fair, cattle, and butter market.","local","fixed","17","9","","","","","","2",""
"802","7760","","","1514","","Fair on Misericordias Domini.","local","movable","","","","","Misericordia","","","",""
"804","7760","","","1514","","Fair on St. Matthew's day","local","fixed","21","9","","","","","","",""
"806","2002","","","1263","","Heinrich der Erlauchte verleiht Freiberg 1263 einen 14-tägigen Markt","regional","fixed","","","","","","","","",""
"808","8879","","26","1465","","St. Peter (horse fair), in and some time before 1464 held on 25 or 26 June.","local","fixed","29","6","","","","","","",""
"810","296","","","1294","","At least from 1294/95 onward, a fair was being held on Midfast. Around the middle of the fourtheenth century, town accounts of Deventer mention a fair in Arnhem 'in festo Palmarum' or '(in) Palmis', which could refer to the Mid-Fast fair. If this is true, it lasted at least two weeks. According to Z.W. Sneller, the Arnhem Palm Sunday fair was only short-lived and ceased to function altogether in the same century. In 1386, it is still mentioned. ","regional","movable","","","","","Letare","","","",""
"812","296","","","1294","","From at least 1294/95 onward, a fair was held on the Feast of the Birth of St. Mary. ","regional","fixed","8","9","","","","","","",""
"814","296","","","1294","","At least from 1294/95 a fair was being held on St. Martin. In 1240, this fair is mentioned a few days earlier on St. Willibrord (7 November). St. Martin's fair probably lasted at least three weeks. It was, at least at the beginning of the fifteenth century, visited by merchants from Deventer. ","regional","fixed","11","11","","","","","","","21"
"816","296","","","1459","","In 1459, Arnold, duke of Guelders, granted a cattle fair to Arnhem. The fair would be held on the day before St. Luke. This grant alarmed the towns of Deventer, Kampen and Zwolle. ","regional","fixed","17","10","","","","","","",""
"818","1753","","","1397","","In 1297, William I, duke of Guelders, granted the right to hold a fair eight days after the Sunday after Easter to Elburg. ","regional","movable","","","","","Misericordia","","-7","7",""
"820","1753","","","1397","","In 1397, William I, duke of Guelders, granted the right to hold a fair on St. Gallus, lasting eight days before and eight days after the fair date. Its ‘market freedom’ was based on the example of Arnhem.The Duke ordered his officials to ensure that eight days before and three days after the fair of St. Gallus, no-one was to transport his commodities to a market or fair other than Elburg’s. These measures should protect the fair of Elburg from the cattle fair in Arnhem, starting just one day after the Elburg fair. ","regional","fixed","16","10","","","","","-7","7",""
"822","2807","","","1294","","At least from 1294/95 onward, a fair was being held on Pentecost. On the occasion of the re-granting of the town privileges of Harderwijk in 1312, it was allowed that the fair be held for a maximum of fourteen days. It is highly questionable whether this 1312 stipulation has ever had any real value.","regional","movable","","","","","Pentecost","","","","14"
"824","2807","","","1424","","In 1424, Harderwijk was granted a second fair on Reminiscere-Midfast. A municipal degree ordained the merchandise in this fair to be toll-free.","regional","movable","","","","","Reminiscere","","","13",""
"826","2807","","","1524","","Around 1524, there was a specialized oxen fair besides the two existing fairs on October 6th.","regional","fixed","6","10","","","","","","6","9"
"828","2862","","","1353","","In 1353, Duchess Alianora (second wife of Reinald (Reginald) II), Lady of the Veluwe, granted a fair on Sunday before Pentecost. ","local","movable","","","","","Palmarum","","","",""
"830","2862","","","","","In 1353, Duchess Alianora (second wife of Reinald (Reginald) II), Lady of the Veluwe, granted a fair on 11.000 Virgins. ","local","fixed","21","10","","","","","","",""
"832","8114","","","1294","","From at least 1294/95 onward, Wageningen had one fair on St. James. In 1312, the duration of this fair was fixed on eight days before St. James and eight days after St. James. It is highly questionable whether this 1312 stipulation had any real value: possibly, these stipulations have never been active.","local","fixed","25","7","","","","-7","","","7"
"834","6505","","","","1498","","local","fixed","1","5","","","","","","",""
"836","6505","","834","1499","","","local","fixed","14","10","","","","","","",""
"838","6505","","","1499","","","local","movable","","","Monday","after","Letare","","","",""
"840","6505","","834","1499","","","local","movable","","","","","Pentecost","","","",""
"842","10699","","","1409","","Fair on Monday after Pentecost, existed before the privileges from 1409","local","movable","","","Monday","after","Pentecost","","","",""
"844","10699","","","1409","","Fair on the day after All Hallow's day, existed before the privileges from 1409.","local","fixed","2","11","","","","","","",""
"846","10699","","","1409","","Veitsmarket, existed before the privileges from 1409","local","fixed","15","6","","","","","","",""
"848","10699","","","1409","","Fair on St. Mauritius' Day, later known as the ""Feldmarkt"".","local","fixed","22","9","","","","","","",""
"850","10699","","","1589","","Fair on Candlemas Day.","local","fixed","2","2","","","","","","",""
"852","6878","","","","","Market on wednesday before St. Jacob's day.","local","movable","25","7","Wednesday","before","Fixed date","","","",""
"854","10547","","","1456","","Fair on Pentecost","local","movable","","","","","Pentecost","","","2",""
"856","10547","","","1456","","Fair in the first half of October","local","fixed","","10","","","","","","2",""
"858","519","","","1544","","Electorate prince Johann Friedrich grants a fair on Sunday after St. Antonius' day (13th June) to Belgern in 1544.","local","fixed","13","6","","","","","","",""
"860","8322","","","1593","","Horsemarket in Werben","local","fixed","23","6","","","","","","",""
"862","7405","","","1643","","Cattle market on Monday after St. Gallus' day.","local","movable","16","10","Monday","after","Fixed date","","","",""
"864","7601","","","1650","","Cattle market after St. Simonis and Judae.","local","fixed","28","10","","","","","","",""
"870","1377","","","1400","","Fair Petri Pauli; indulgence fair","local","fixed","29","6","","","","","","",""
"872","1377","","","1428","1519","Fair on Sunday after the Assumption of Mary.","local","fixed","15","8","","","","","","",""
"874","1377","","872","1520","","Fair on Sunday after the Assumption of Mary is moved to Sunday after All Saint's Day, since the harvest was still brought in on Assumption of Mary.","local","fixed","1","11","","","","","","",""
"876","1377","","","1487","","The first mention of the Lent market occurs in 1487, it is, however, only eleveted to fair in 1550.","local","movable","","","Saturday","before","Invocavit","","","",""
"878","1401","","","1650","","Fair on Reminiscere. The fair is mentioned together with school vacations in the middle of the 17th century.","local","movable","","","","","Reminiscere","","","",""
"880","1445","","","","","Cattle and horse fair on St. Gertrud's Day.","local","fixed","17","3","","","","","","",""
"882","1445","","","","","Fair on Sunday after the birth of John the Baptist.","local","fixed","24","6","","","","","","",""
"884","2094","","","","1579","Fair in the middle of lent","regional","movable","","","","","Letare","","","",""
"886","2094","","","1579","","Fair on Monday after Invocavit","regional","movable","","","Monday","after","Invocavit","","","3",""
"888","2094","","","1579","","Fair on Monday after Palmarum","local","movable","","","Monday","after","Palmarum","","","3",""
"890","2094","","","1579","","Fair on St. Peter and Paul's day.","regional","fixed","29","6","","","","","","3",""
"892","2094","","","1579","","Fair on Monday after Michaelis","regional","fixed","29","9","","","","","","3",""
"894","7601","","","","1587","Fair on Tuesday after Trinitatis","local","movable","","","Tuesday","after","Trinitatis","","","",""
"896","7601","","894","1588","","In 1587, town and council of Tangermünde are allowed to move the fair to Tuesday after Jocunditatis.","local","movable","","","Tuesday","after","Vocem","","","",""
"898","59","","","1460","","","local","movable","20","1","Wednesday","before","Fixed date","","","",""
"900","59","","","1460","","","local","movable","","","Wednesday","before","Oculi","","","",""
"902","59","","","1460","","","local","movable","","","Wednesday","before","Cantate","","","",""
"904","59","","","1460","","","local","movable","20","7","Wednesday","before","Fixed date","","","",""
"906","59","","","","","","local","movable","22","9","Wednesday","before","Fixed date","","","",""
"908","3612","","","","","","local","fixed","24","8","","","","","","1",""
"910","3612","","","","","","local","fixed","23","4","","","","","","1",""
"912","4525","","","1562","","Fair on Tuesday after the 5th Sunday of lent","local","movable","","","Tuesday","after","Judica","","","",""
"914","4525","","","1562","","Fair on Tuesday before the Visitation of Mary","local","movable","2","7","Tuesday","before","Fixed date","","","",""
"916","4525","","","1562","","Fair on thursday 14 days before St. Martin's day.","local","movable","11","11","Tuesday","before","Fixed date","","","",""
"918","4742","","","1586","","Fair on Monday after Cantate","local","movable","","","Monday","after","Cantate","","","",""
"920","4742","","","1586","","Fair on Monday before the decapitation of John the Baptist.","local","movable","29","8","Monday","before","Fixed date","","","",""
"922","4988","","","1555","","Fair on Rogation sunday","local","movable","","","","","Vocem","","","",""
"924","4988","","","1555","","Fair on Sunday after the Birth of the Blessed Virgin Mary.","local","movable","8","9","Sunday","after","Fixed date","","","",""
