"ID","Nodes_ID","Name","Continuation_From_ID","From","To","Description","Category","Date","Fixed_Day","Fixed_Month","Weekday","Before_After","Date_Depends_On","Start_Max","Start_Min","End_Min","End_Max"
"282","8974","","","1310","","Pentecost market","regional","movable","","","","","Pentecost","","","7",""
"284","8974","","","1311","","Market on St John. The market does not seem to have enjoyed a great importance, possibly due to competition from the St John's market in nearby Landegge.","local","fixed","24","6","","","","","","7",""
"286","2036","","","1497","1564","Eight-day fair on St Giles","regional","fixed","1","9","","","","","","7",""
"288","2036","","","1497","1564","Eight-day fair on the day of the Eleven Thousand Virgins","regional","fixed","21","10","","","","","","7",""
"290","2036","","","1369","1496","Fair on Thursday before St John","regional","movable","24","6","Thursday","before","Fixed date","","","",""
"294","2777","","","1188","","Fair on the Ascension of Mary in the Neustadt.","regional","fixed","15","8","","","","","","",""
"296","2777","","","1188","","Fair on St Vitus in the Neustadt. It was followed by a horse market of probably 8 days.","regional","fixed","15","6","","","","","","","8"
"298","2777","","","1000","","Fair on St Felicianus in the Altstadt. A founding date is not known, but it probably goes back into the 11th century. It was followed by a horse market of probably 8 days.","regional","fixed","20","10","","","","","","","8"
"300","2777","","","1365","1383","Three-week Pentecost fair, founded by Emperor Charles IV in 1365, which was not well received. Five years after the death of the Emperor, the fair was cancelled.","local","movable","","","","","Pentecost","","","20",""
"302","2777","","","1435","","Eight-day horse market on Sunday after Lent.","regional","movable","","","","","Letare","","","7",""
"304","2777","","","1471","","Four-day horse market three weeks before Estomihi.","local","movable","","","Sunday","before","Cicumded","","","3",""
"306","2777","","","1471","","Four-day horse market on Sunday Oculi.","local","movable","","","","","Oculi","","","3",""
"308","2777","","","1471","","Four-day horse market on Palm Sunday.","local","movable","","","","","Palmarum","","","3",""
"310","2777","","","1471","","Four-day horse market on All Apostle's day.","local","fixed","15","7","","","","","","3",""
"312","122","","160","1619","","The fair on St Vitus was extended to 3 days with a cattle market in 1619.","local","fixed","15","6","","","","","","2",""
"314","122","","162","1619","","The fair on St Gallus was extended to three days with a cattle market in 1619.","local","movable","16","10","Thursday","before","Fixed date","","","2",""
"316","3050","","242","1523","","The fair on Misericordia Sunday must have been shortened to three days between 1488 and 1523.","local","movable","","","","","Misericordia","","-1","1",""
"318","3050","","238","1523","","The fair of St Michael was shortened to three days between 1488 and 1523.","local","fixed","29","9","","","","","-1","1",""
"320","3050","","","1523","","The fair on the Annunciation was revived as a three-day fair between 1488 and 1523.","local","fixed","25","3","","","","","-1","1",""
"322","3050","","","1488","","A new three-day fair on Wednesday after Pentecost was installed between 1488 and 1523.","local","movable","","","Wednesday","after","Pentecost","","-1","1",""
"324","4337","","","1170","","The fair from Sunday Jubilate until Cantate was one of the two oldest fairs of the town and may date back to the foundation of the town in 1170. In the 15th century it grew to have international significance. In 1497 the fair was confirmed by Maximilian I. (who hadn't been crowned emperor at this point!) including safe conduct of three weeks, in 1507 extended by a ban zone ('Bannmeile') of 15 miles and a staple.","interregional","movable","","","","","Jubilate","","","7",""
"326","4337","","","1170","","The eight-day-fair on Sunday after St. Michael's day was one of the two oldest fairs of the town and may date back to the foundation of the town (in other places it is postulated that it was moved from Zeitz to Leipzig). It grew to have international significance in the 15th century. In 1497 the fair was confirmed by Maximilian I. (who hadn't been crowned emperor at this point!) including safe conduct of three weeks, in 1507 extended by a ban zone ('Bannmeile') of 15 miles and a staple.","interregional","fixed","29","9","","","","","","7",""
"328","1987","Fastenmesse","256","1384","1393","The Lent fair, of which the duration was often exceeded, was extended with two weeks in 1384. However, the extension was reverted again after ten years.","interregional","movable","","","","","Oculi","","","28",""
"330","1987","","258","1384","1393","The autumn fair was extended with two weeks in 1384, but the extension was reverted again after ten years.","interregional","fixed","15","8","","","","","","38",""
"332","1987","","328","1394","1478","In 1394, the end of the Lent fair was set to Friday before Palm Sunday.","interregional","movable","","","","","Oculi","","","18",""
"334","1987","","330","1394","1398","In 1394 it was decided that the autumn fair was to last not longer than until the Nativity of Mary.","interregional","fixed","15","8","","","","","","30",""
"336","1987","","334","1399","","The Frankfurt council decided in 1399 in agreement with the merchants, that the old duration of the autumn fair, between the Ascension and the Nativity of Mary, was to be restored.","interregional","fixed","15","8","","","","","","23",""
"338","1987","Fastenmesse","332","1479","1499","The Frankfurt council decided in 1479 after frequent disregard of the official dates, that the Lent fair was to last not longer than until the Sunday before Easter, and allowed a four-day trade period before and after the fair. This was a situation that probably had been practised already since the mid-14th century.","interregional","movable","","","","","Oculi","","","22",""
"340","1987","Fastenmesse","338","1500","","Despite frequent admonitions of the Frankfurt council to stick to the dates set for the Lent fair set in 1479 (Oculi Sunday until the Sunday before Easter), the fair was often organised at a later date. For example in 1502, it began on Palm Sunday and ended 14 days after Easter. In the 16th and 17th century, it was usually organised between Judica Sunday and Tuesday after Easter.","interregional","movable","","","","","Judica","","","16",""
"342","1","","","","1717","Fair on Sunday after Estomihi","local","movable","","","","","Invocavit","-1","","","1"
"344","8447","","","1507","1528","Fair on the day of the Eleven thousand Virgins","local","fixed","21","10","","","","","","2",""
"346","8447","","344","1529","","Fair on St Dionysius","local","fixed","9","10","","","","","","2",""
"348","1379","","","1601","","A fair for cattle, horses and retail on four days before St Dionysius was founded by the count of Delmenhorst in 1601. Consequently, his brother, the count of Oldenburg, prohibited his subjects to visit the market. The fair must have declined afterwards, as it was re-installed in 1653.","local","fixed","6","10","","","","","","",""
"350","5623","","","1608","","Quasimodogeniti","local","movable","","","","","Quasimodo","-1","","","1"
"352","5623","","","1608","","St Michael","local","fixed","29","9","","","","-1","","","1"
"354","4653","","","1300","","Fair on Sunday Jubilate.","local","movable","","","","","Jubilate","","","",""
"356","4475","","","1306","","Fair on the day of the 11000 Virgins.","local","fixed","21","10","","","","","","",""
"358","5704","Herrenmesse","","1002","1490","The four-day ""Herrenmesse"" or Dedication day of the cathedral took place on St Crispin and Crispinian and probably went back to the market privilege of 1002.","regional","fixed","25","10","","","","","","3",""
"360","5704","","","1002","","A four-day market on mid-Lent probably goes back to the market privilege of 1002.","regional","movable","","","","","Letare","","-3","",""
"362","5704","Neuer Markt","","1190","1491","The four-day ""new market"" on the Exaltation of the Holy Cross is first mentioned in 1190 and disappeared between 1471 and 1491.","regional","fixed","14","9","","","","","","3",""
"368","2840","","","1307","","Eight-day fair on Sunday Laetare","regional","movable","","","","","Letare","","","7",""
"372","4881","","","1300","1496","Fair on St Michael","regional","fixed","29","9","","","","","","",""
"376","4881","","","1482","1577","Cattle fair on Wednesday before 1 May","local","movable","1","5","Wednesday","before","Fixed date","","","",""
"378","4881","","","1482","1577","Cattle fair on Wednesday before Pentecost","local","movable","","","Wednesday","before","Pentecost","","","",""
"380","4216","","","1238","","Fair on Pentecost","regional","movable","","","","","Pentecost","","","",""
"382","4216","","","1238","","Fair on St John","regional","fixed","24","6","","","","","","",""
"384","4216","","","1328","","Fair on the Nativity of Mary","regional","fixed","8","9","","","","","","",""
"388","280","","","1327","","Fair after the Octave of Easter","local","movable","","","Monday","after","Quasimodo","","","",""
"390","280","","","1327","","Fair after the Nativity of Mary","local","fixed","9","9","","","","","","",""
"392","280","","","1327","","Fair on the octave of Epiphany","local","fixed","13","1","","","","","","",""
"394","4309","","","1508","","St Gall's market, founded in 1508","local","fixed","16","10","","","","","","",""
"396","4309","","","1528","","Market of the Holy Cross, founded in 1528. Besides butter and cheese, the market was important for the sale of flax from the surrounding countryside.","local","fixed","14","9","","","","","","",""
"398","8240","","","1508","","St Bartholomew's market, founded in 1508.","local","fixed","24","8","","","","","","",""
"400","351","Stille Markt","","1440","","""Silent market"" on Laetare Sunday","regional","movable","","","","","Letare","","","",""
"402","2177","","","1580","","A fair in Gesmold is mentioned in 1580, which is specified in 1599 as a market for retail and cattle, taking place on Monday after the Exaltation of the Holy Cross.","local","movable","14","9","Monday","after","Fixed date","","","",""
"408","973","","266","1638","","The Autumn market on St Dionysius was prolonged to nine days in 1638.","regional","fixed","9","10","","","","","","8",""
"410","973","","","1638","","Three-day fair on Quasimodogeniti, which replaced the Spring fair in 1638.","regional","movable","","","","","Quasimodo","","","2",""
"412","973","","","1638","","Three-day fair on Ascension Day, which replaced the Spring fair in 1638.","regional","movable","","","","","Ascension","","","2",""
"414","973","","","1638","","Horse fair on Wednesday after Invocavit.","local","movable","","","Wednesday","after","Invocavit","","","2",""
"416","973","","","1638","","Horse fair on the day after St John the Baptist.","local","fixed","25","6","","","","","","2",""
"418","973","","","1638","","Horse fair on the day after the Dispersion of the Apostles.","local","fixed","16","7","","","","","","2",""
"420","973","","","1638","","Fair for foals, two days after St Mauritius.","local","fixed","24","9","","","","","","1",""
"426","2778","","","1350","1555","Fair on St Boniface, first mentioned around 1350. It was replaced by two new fairs in 1556.","regional","fixed","5","6","","","","","","","7"
"428","2778","","","1350","1555","Fair on St Michael, first mentioned around 1350.","regional","fixed","29","9","","","","","","","7"
"430","2778","","","1350","1555","Fair ""tho der hoighen kerkemisse"" on All Saints, first mentioned around 1350.","regional","fixed","1","11","","","","","","","7"
"432","2778","","428","1556","","St Michael's fair is mentioned on Monday after St Michael in 1556.","regional","movable","29","9","Monday","after","Fixed date","","","","7"
"434","2778","","430","1556","","The All Saints' fair is mentioned as taking place on Monday after All Saints in 1556.","regional","movable","1","11","Monday","after","Fixed date","","","","7"
"436","2778","","426","1556","","Fair on Monday after Letare, first mentioned in 1556.","regional","movable","","","Monday","after","Letare","","","","7"
"438","2778","","","1556","","Fair on the second Monday after Trinity Sunday, first mentioned in 1556.","regional","movable","","","Monday","after","Sacramentum","","","","7"
"440","975","","","1582","","Fair on Ascension Day.","local","movable","","","","","Ascension","","","","2"
"442","2036","","286","1565","","Fair on St Matthew, founded in 1565.","local","fixed","21","9","","","","","","",""
"444","2036","","288","1565","","Fair on the holiday of the Ten thousand martyrs, founded in 1565.","local","fixed","22","6","","","","","","",""
"446","4202","","","1300","","Fair on the Birth of St John the Baptist, founded in the 14th century.","local","fixed","24","6","","","","","","",""
"448","4202","","","1300","","Fair on the Dedication day on the Exaltation of the Holy Cross, which came into existence in the 14th century.","local","fixed","14","9","","","","","","",""
"450","4881","","372","1497","","The main fair in Meppen, previously on St Michael, was held on St Simon and Jude in 1497.","local","fixed","28","10","","","","","","",""
"454","4881","","376","1578","","Cattle fair on the day after St George","local","fixed","24","4","","","","","","",""
"456","4881","","378","1578","","Cattle fair on St Victor's eve","local","fixed","9","10","","","","","","",""
"458","1429","","","1525","1576","Fair on three days before and after the Day of Our Lady. It was replaced by a new market in 1577.","local","fixed","15","8","","","","","-2","2",""
"460","1429","","","1525","1576","Fair on three days before and after St Dionysius. It was replaced by a new fair in 1577.","local","fixed","9","10","","","","","-2","2",""
"464","1429","","","1577","1613","Cattle fair on Monday after Palm Sunday. In a confirmation of the market privileges from 1614, it is not mentioned any more.","local","movable","","","Monday","after","Palmarum","","","",""
"466","1429","","","1577","","Cattle fair on the day after St Matthew. It was confirmed in 1614.","local","fixed","22","9","","","","","","",""
"470","9038","","","1378","","On the day of Mary Magdalene, a dedication day of the chapel with a retail fair took place. The market remained in place after the chapel was destroyed in 1519, but is first mentioned certainly only in 1653.","local","fixed","22","7","","","","","","",""
"472","4475","","","1401","","Fair of St Walpurgis","local","fixed","1","5","","","","","","",""
"476","5704","Herrenmesse","358","1491","","The ""Herrenmesse"", originally on St Crispin and Crispinian, was later moved to 1 October, probably after the disappearance of the ""new"" market, 1491 at the latest.","regional","fixed","1","10","","","","","","3",""
"478","8757","","","1613","","Fair on Sunday before St Michael.","local","movable","29","9","Sunday","before","Fixed date","","","",""
"480","8005","","","985","1619","Fair on the Dedication day of the cathedral, which was confirmed in 1491, 1515 and 1535. The 1491 privilege mentions fourteen days before St Walpurga as date.","local","fixed","17","4","","","Quasimodo","","","",""
"484","7321","","","1038","","Fair on St James's Day, mentioned to have a duration of 14 days in 1692.","regional","fixed","25","7","","","","","","","13"
"486","7321","","","1593","","Fair on Tuesday after Easter, which is mentioned to have had a duration of 8 days in 1692.","local","movable","","","Tuesday","after","Easter","","","","7"
"488","7321","","","1593","","Horse market on Letare Sunday.","local","movable","","","","","Letare","","","",""
"490","1154","","","1287","","Fair on St Lawrence. Later it was connected to a horse market.","local","fixed","10","8","","","","","","2",""
"492","1154","","","1420","","Fair on St Martin's day. It lasted for 14 days in the 16th century.","regional","fixed","11","11","","","","","","13",""
"494","1154","","","1474","1573","A horse market was founded in 1474, which was connected to a fair on St Peter and Paul's Day. The horse market was moved to Wednesday before Palm Sunday in 1511, but the Peter and Paul fair remained in existence until 1573.","local","fixed","29","6","","","","","","2",""
"496","1154","","","1511","","The horse market was moved to Wednesday before Palm Sunday in 1511 and lasted a week.","regional","movable","","","Wednesday","before","Palmarum","","","6","7"
"498","1154","","","1531","1582","Fair on Thursday and Friday before Palm Sunday.","local","movable","","","Thursday","before","Palmarum","","","1","2"
"500","1154","","498","1583","","The Palm Sunday fair was moved to the entire week after Judica in 1583.","regional","movable","","","Monday","after","Judica","","","6",""
"502","1154","","","1559","","A Pentecost market is mentioned in 1559.","local","movable","","","","","Pentecost","","","2",""
"508","8036","","","1450","1541","A fair on the dedication day of the local church on the day after the Nativity of Mary existed since pre-Reformation times, possibly since Visselhövede acquired borough ('weichbild') privileges.","local","fixed","8","9","","","","","","",""
"510","8036","","508","1542","","The fair on dedication day was moved to the Sunday after the Nativity of Mary in 1542.","local","movable","8","9","Sunday","after","Fixed date","","","",""
"512","7894","","","1584","","Fair on dedication day on the Day of the Nativity of Mary, attested since the late 16th century.","local","fixed","8","9","","","","","","",""
"514","7894","","","1584","","Fair on Sunday Invocavit, first attested in the late 16th century.","local","movable","","","","","Invocavit","","","",""
"516","3213","","","1552","","Fair on St Walpurga's day.","local","fixed","1","5","","","","","","",""
"518","3213","","","1552","","Fair on Sunday before St Martin","local","movable","11","11","Sunday","before","Fixed date","","","",""
"520","1330","","","1293","","Three-day fair on the Birth of St Mary, which already existed in 1365","local","fixed","8","9","","","","","","2",""
"522","1330","","","1365","","Dannenberg acquired a second fair in 1365, in the week after Easter.","local","movable","","","Monday","after","Easter","","","",""
"526","8580","","","1570","1583","Fair in the Neustadt on 9 May.","local","fixed","9","5","","","","","","",""
"528","8580","","","1570","1583","Fair in the Neustadt on 4 November.","local","fixed","4","11","","","","","","",""
"530","8580","","","1584","1601","Twelve-day fair on 14 January, granted in 1584, abolished in 1601.","local","fixed","14","1","","","","","","11",""
"532","8580","","526","1584","1601","The spring fair was moved to 14 April in 1584 and prolonged to twelve days.","local","fixed","14","4","","","","","","11",""
"534","8580","","","1584","1601","Twelve-day fair on 14 July, granted in 1584, abolished in 1601.","local","fixed","14","7","","","","","","11",""
"536","8580","","528","1584","1601","The autumn fair was moved to 14 November in 1584 and prolonged to twelve days.","local","fixed","14","11","","","","","","11",""
"538","8580","","532","1602","","Due to the failure of the project to develop Wolfenbüttel into a major trade hub, the spring market was moved to 5 May in 1602 and its duration shortened to eight days.","local","fixed","1","5","","","","","","7",""
"540","8580","","536","1602","","Due to the failure of the project to develop Wolfenbüttel into a major trade hub, the autumn market was moved to 5 November in 1602 and its duration shortened to eight days.","local","fixed","5","11","","","","","","7",""
"542","1911","","","1573","","Fair on Misericordia Sunday.","local","movable","","","","","Misericordia","","","",""
"544","1911","","","1573","","Fair on Sunday after St Lawrence.","local","movable","10","8","Sunday","after","Fixed date","","","",""
"546","1911","","","1573","","Fair on 14 days after St Martin.","local","fixed","24","11","","","","","","",""
"548","2049","","","1495","","Bishop Konrad IV of Osnabrück granted a five-day fair in 1495, from Saturday before St Michael until the following Wednesday.","local","movable","29","9","Saturday","before","Fixed date","","","4",""
"550","8005","","","1491","","Fourteen days before St Bartholomew","local","fixed","21","8","","","","","","",""
"552","8005","","","1491","","Eight days before St Bartholomew","local","fixed","17","8","","","","","","",""
"554","8005","","480","1620","","In 1620, Quasimodogeniti was mentioned as day of the fair on the Dedication day of the cathedral.","local","movable","","","","","Quasimodo","","","",""
"556","273","","","1582","","Eight days after Pentecost","local","movable","","","","","Trinitatis","","","",""
"558","273","","","1582","","Birth of Mary","local","fixed","8","9","","","","","","",""
"560","2151","","","1354","","Restoration of the market on the old date in autumn.","regional","fixed","21","","","","","","-7","7",""
"562","2151","","","1349","1354","","regional","fixed","24","6","","","","","-7","7",""
"564","2151","","","1559","","","regional","fixed","","","","","","","","",""
"566","2151","","","1571","","","regional","movable","","","","","Misericordia","","","",""
"568","7374","","","1290","","","local","fixed","25","6","","","Cantate","","","",""
"570","7374","","","1290","","","local","movable","","","","","Cantate","","","",""
"572","7374","","","1290","","","local","fixed","29","9","","","","","","",""
"574","7374","","","1290","","","local","fixed","25","11","","","","","","",""
"576","3267","","","1310","","","local","fixed","25","2","","","","","","",""
"578","3267","","","1310","","","local","fixed","25","7","","","","","","",""
"580","3267","","","1310","","","local","fixed","14","9","","","","","","",""
"586","4622","","","1398","","Fair on Sunday Oculi.","local","movable","","","","","Oculi","","","",""
"588","4622","","","1398","","Fair on the Exaltation of the Holy Cross (Crucis)","local","fixed","14","9","","","","","","",""
"590","9595","","","1440","","14 days after Pentecost (Caland)","local","movable","","","Sunday","after","Trinitatis","","","",""
"594","9595","","","1440","","Market on the dedication day of St Magnus Church, held on St Bartholomew. Later moved to September.","local","fixed","24","8","","","","","","",""
"598","8185","","","1366","","St Matthew","local","fixed","25","2","","","","","","2",""
"600","8185","","","1366","","Monday after Ascension day","local","movable","","","Monday","after","Ascension","","","2",""
"602","8185","","","1366","","St James","local","fixed","25","7","","","","","","2",""
"604","8185","","","1366","","St Simon and Juda","local","fixed","27","10","","","","","","2",""
"606","8185","","","","","St Michael in the old town","local","fixed","29","9","","","","","","",""
"608","3934","","","1480","","Fair on St Bartholomew's Day","local","fixed","24","8","","","","","","",""
"610","2765","","","1128","","Mention in a recommendation of bishop Otto of Bamberg, who recommends buying wares during the fair of Halle. Furter mentions around 100 years later as the fair to the Nativity of Mary (8th September).","local","fixed","8","9","","","","","-3","3",""
"612","5092","","","1317","1638","Fair held on St. Kilian's day. Its date changed slightly. It could have lasted until St. Margaret's on 22nd July.","regional","fixed","8","7","","","","","","7",""
"614","5092","","","","","Fair held on Exaudi, on the Upper Market.","regional","movable","","","Monday","after","Exaudi","","","7",""
"616","5092","","","","","Fair held on Michaelis.","regional","fixed","19","7","","","","","","7",""
"618","5092","","","1638","","Mention of a fair on the Blobach.","local","fixed","","","","","","","","",""
"620","5460","","","1100","","Fair on the Elevation of the Holy Cross","local","fixed","3","5","","","","","","","3"
"622","5460","","","1100","","Fair on the Exaltation of the Holy Cross","local","fixed","14","9","","","","","","","3"
"624","5165","Peter-Pauls-Markt","","1278","1833","Fair on St. Peter and Paul's day. The fair was moved from Zeitz to Naumburg together with the episcopal seat in the 11. century. Since the 16th century, the Naumburg Peter-and-Paul's market is largely included in the fair system of Leipzig, which effectively leads to four important fairs within the region of Leipzig.","regional","fixed","29","6","","","","","","4",""
"626","5165","","","1278","1667","First mentioned in 1278 but we only get some information on the fair in a confirmation from 1514. Therein, the fair was moved from Holy Thursday to sexagesimae, but Leipzig protested fiercely. The fair was never held on that date and had to be cancelled in 1667. Another fair on Palm Sunday was allowed by Leipzig, but the extended privileges given to an interregional fair such as the Peter-Pauls-fair were forbidden. It is known until today as the Topfmarkt and was moved to Firday after Easter in 1894.","local","movable","","","Thursday","before","Easter","","","",""
"630","3411","","","1354","","","local","movable","","","","","Cantate","","","",""
"632","3411","","","1435","","Merely indirect datation possible: probably on the 28th October.","local","fixed","28","10","","","","","","",""
"634","3411","","","1486","","On 20th June 1486, the electoral prince granted the right to have a cattle market – there are no reports as to its dates though.","local","fixed","","","","","","","","",""
"636","3411","Aegidienmarkt","","1492","","The fair on St. Aegis' day was confirmed in 1648 and 1686 after the 30-year war. ","regional","fixed","1","9","","","","","-2","2",""
"638","8752","Brüdermarkt/Brüderablass","","1252","","Fair connected to the church consecration festival in Zeitz. Only locals are allowed to trade at first, in 1532 trade by non-locals is allowed.","local","movable","","","","","Ascension","","","",""
