"ID","Ref_Short","Ref_Long","Type"
"1050","UB Stadt Hildesheim","Doebner, Richard; Brandes, Hermann (eds.), &#60;cite&#62;Urkundenbuch der Stadt Hildesheim&#60;/cite&#62;, 8 vols. (Hildesheim, 1881-1901)","edition"
"1052","Laur 1992","Laur, Wolfgang, &#60;cite&#62;Historisches Ortsnamenlexikon von Schleswig-Holstein&#60;/cite&#62; (2nd revised ed.; Neumünster, 1992)","secondary"
"1054","Lorenzen-Schmidt; Pelc 2006","Lorentzen-Schmidt, Klaus-Joachim; Pelc, Ortwin (eds.), &#60;cite&#62;Das neue Schleswig-Holstein Lexikon&#60;/cite&#62; (2nd revised ed.; Neumünster, 2006)","secondary"
"1056","Müller 1986","Müller, Siegfried, &#60;cite&#62;Leben im alten Hannover: Kulturbilder einer deutschen Stadt&#60;/cite&#62; (Hannover, 1986)","secondary"
"1058","Stübner 1800","Stübner, Johann Christoph, &#60;cite&#62;Geographische, naturhistorische und vorzüglich mineralogische Beschreibung des Harzgebirges. Nebst Darstellung des auf dem Harz befindlichen Berg- und Hüttenwesens. Erster Theil.&#60;/cite&#62; (Leipzig 1800).","secondary"
"1060","Jager 2015","Jager, Alexander, &#60;cite&#62;Middeleeuws Kampen. De ruimtelijke en economische structuur van de stad aan de hand van archeologische, bouwhistorische, numismatische en historische bronnen&#60;/cite&#62; (Zwolle, 2015).","secondary"
"1062","Canon van Kampen","&#60;a href=&#34;https://www.entoen.nu/nl/overijssel/salland/kampen&#34;&#62;Canon van Kampen&#60;/a&#62;","secondary"
"1064","Canon van Kampen",,"secondary"
"1066","Canon van Kampen","&#60;a href=&#34;www.entoen.nu/nl/overijssel/salland/kampen/ijsselbrug&#34;&#62;&#60;/a&#62;.","secondary"
"1068","Niemann 1920","Niemann, Konrad, &#60;q&#62;Die alten Heer- und Handelsstraßen in Thüringen.&#60;/q&#62; in: &#60;cite&#62;Mitteilungen des sächsisch-thüringischen Vereins für Erdkunde.&#60;/cite&#62; 39 - 43 (1915 - 1919), 1920, 1 - 64.","secondary"
"1070","NOB Uelzen","Dolle, Josef (ed.), &#60;cite&#62;Niedersächsisches Ortsnamenbuch, Landkreis Uelzen &#60;/cite&#62; (in preparation)","secondary"
"1072","Zangel 2007","Zangel, Frederic, &#60;q&#62;Burgen im Personen- und Handelsverkehr Stormarns in Mittelalter und Früher Neuzeit. Das Beispiel Trittau&#60;/q&#62;, in &#60;cite&#62;Nutzung gestaltet Raum. Regionalhistorische Perspektiven zwischen Stormarn und Dänemark&#60;/cite&#62;, ed. Oliver Auge; Norbert Fischer (Frankfurt am Main, 2007), 151-167","secondary"
"1074","Prange 1999","Prange, Wolfgang, &#60;q&#62;Trittau in lübscher Hand 1534&#60;/q&#62;, &#60;cite&#62;Zeitschrift des Vereins für Lübeckische Geschichte und Altertumskunde&#60;/cite&#62; 79 (1999), 146-163","secondary"
"1076","Hansen 1992","Hansen, Reimer, &#60;q&#62;Der Kieler Umschlag. Entstehung, Konjunktur und Funktionswandel eines internationalen Geldmarktes vom Ausgang des Mittelalters bis zum Anbruch der Moderne&#60;/q&#62;, &#60;cite&#62;Zeitschrift der Gesellschaft für Schleswig-Holsteinische Geschichte&#60;/cite&#62; 117 (1992), 101-133","secondary"
"1078","UB Hameln","Meinardus, Otto; Fink, Erich (eds.), &#60;cite&#62;Urkundenbuch des Stiftes und der Stadt Hameln&#60;/cite&#62;, 2 vols. (Hannover, 1887-1903)","edition"
"1080","Kienzle 1969","Kienzle, Robert, &#60;cite&#62;Chronik Kirchlinteln&#60;/cite&#62; (Kirchlinteln, 1969)","secondary"
"1082","Hofmeister 2011","Hofmeister, Adolf E., &#60;q&#62;Eitze im Mittelalter. Von Wundern, Rittern und Meierabgaben&#60;/q&#62;, in &#60;cite&#62;860-2010. 1150 Jahre Eitze&#60;/cite&#62;, ed. by Adolf E. Hofmeister; Anja König (Verden, 2011), 13-32","secondary"
"1084","Streich; Reitemeier 2011","Streich, Gerhard; Reitemeier, Arnd (eds.), &#60;cite&#62;Regionalkarte: Geschichte und Landeskunde, Blätter Einbeck und Seesen. Erläuterungsheft&#60;/cite&#62; (Göttingen, 2011)","secondary"
"1086","Fermin 2007","Fermin, Bert, &#60;cite&#62;Een rondje om de Warnsveldse kerk. Archeologisch proefsleuvenonderzoek op het Kerkplein te Warnsveld&#60;/cite&#62;, Zutphense Archeologische Publicaties 30 (Zutphen, 2007).","secondary"
"1088","Petersen; Pischke; Streich 2013","Petersen, Niels; Pischke, Gudrun; Streich, Gerhards (eds.), &#60;cite&#62;Regionalkarte zur Geschichte und Landeskunde, Blätter Hildesheim und Bad Salzdetfurth. Erläuterungsheft&#60;/cite&#62; (Hannover, 2013)","secondary"
"1090","UB Göttingen","Schmidt, Karl Gustav (ed.), &#60;cite&#62;Urkundenbuch der Stadt Göttingen&#60;/cite&#62;, 2 vols (Hannover, 1863-1867)","edition"
"1092","Kühlhorn 1972","Kühlhorn, Erhard (ed.), &#60;cite&#62;Historisch-Landeskundliche Exkursionskarte von Niedersachsen, Blatt Göttingen. Erläuterungsheft&#60;/cite&#62; (Hildesheim, 1972)","secondary"
"1094","v. Dreyhaupt 1749","v. Dreyhaupt, Johann Christoph (ed.) &#60;cite&#62;Pagus Neletici et Nudzici oder Ausführliche diplomatische historische Beschreibung des zum ehemaligen Primat- und Ertz-Stifft, nunmehr aber durch den westphälischen Friedensschluß secularisierten Herzogthum Magdeburg gehörigen Saal-Creyses und aller darinnen befindlichen Städte.&#60;/cite&#62; Theil I (Halle/Saale 1749-50).","edition"
"1096","Kunwald, George 1996","Kunwald, George &#60;q&#62;Veje fra oldtid og middelalder i Broskov&#60;/q&#62;, in &#60;cite&#62;Braut&#60;/cite&#62;, ed. by Jens Vellev (Denmark, 1996), 13-36","secondary"
"1098","Jørgensen, Mogens Schou 1996","Jørgensen, Mogens Schou, &#60;q&#62;Oldtidens veje i Danmark&#60;/q&#62;, in &#60;cite&#62;Braut&#60;/cite&#62;, ed. by Jens Vellev (Denmark, 1996), 37-62","secondary"
"1100","Jäger 1964","Jäger, Helmut (ed.), &#60;cite&#62;Historisch-Landeskundliche Exkursionskarte von Niedersachsen, Blatt Duderstadt. Erläuterungsheft&#60;/cite&#62; (Hildesheim, 1964)","secondary"
"1108","Bruns 2020","Bruns, Steffan, &#60;cite&#62;Geiseltalchroniken. Geschichte des Geiseltales und seiner Umgebung&#60;/cite&#62; (Norderstedt 2020).","secondary"
"1110","Vellev 1996","Vellev, Jens, &#60;q&#62;Løvel Bro&#60;/q&#62;, in &#60;cite&#62;Braut&#60;/cite&#62;, ed. Jens Vellev (Denmark, 1996), 63-86","secondary"
"1112","Wozniak 2013","Wozniak, Thomas, &#60;cite&#62;Quedlinburg im 14. und 16. Jahrhundert.&#60;/cite&#62; (Berlin 2013).","secondary"
"1114","Høgsbro 1996","Høgsbro, Kirsten-Elizabeth &#60;q&#62;Broer i vejhistorisk belysning&#60;/q&#62;, in &#60;cite&#62;Braut&#60;/cite&#62;, ed. Jens Vellev (Denmark, 1996), 87-104","secondary"
"1116","Ohlmer 1983","Ohlmer, Walter, &#60;cite&#62;1000 Jahre Moringen 983-1983&#60;/cite&#62; (Hildesheim, 1983)","secondary"
"1118","Domeier 1753","Domeier, Johann Gabriel, &#60;cite&#62;Die Geschichte der Churfürstl. Braunschweig-Lüneburgischen Stadt Moringen und des umliegenden Amts dieses Namens, aus archivalischen Urkunden und andern zuverlässigen Nachrichten verfasset&#60;/cite&#62; (Göttingen, 1753)","secondary"
"1120","Visch 1986","Visch, Wessel Friedrich, &#60;cite&#62;Geschichte der Grafschaft Bentheim&#60;/cite&#62;, transl. Lucie Rakers (Bentheim, 1986: 2nd ed.)","secondary"
"1122","Schneider 1988","Schneider, Ludwig, &#60;cite&#62;Orts- und Gewässernamen im Landkreis Lüneburg&#60;/cite&#62; (Lüneburg, 1988)","secondary"
"1124","Behrens 2004","Behrens, Egon, &#60;cite&#62;800 Jahre Neetze 1205 - 2005. Beiträge zur Ortsgeschichte&#60;/cite&#62; (Husum, 2004)","secondary"
"1126","Hoogstede 2009","Heimatverein Hoogstede e. V. (ed.), &#60;cite&#62;In der Gildschaft Scheerhorn. Hoogstede, Chronik eines Dorfes und seiner Ortsteile Arkel, Bathorn, Berge, Hoogstede, Kalle, Scheerhorn und Tinholt&#60;/cite&#62; (Hoogstede, 2009), online at &#60;a href=&#34;https://www.heimatverein-hoogstede-arkel.de/chronik/&#34;&#62;https://www.heimatverein-hoogstede-arkel.de/chronik/&#60;/a&#62;","secondary"
"1128","Reuter 1950","Reuter, Rektor A. (ed.), &#60;cite&#62;1100 Jahre Delligsen. Geschichte der Hilsmulde und des Ortes Delligsen mit besonderer Berücksichtigung der wirtschaftlichen Entwicklung&#60;/cite&#62; (Bad Gandersheim, 1950)","secondary"
"1130","Schwarz 1977","Schwarz, Hans Wilhelm, &#60;cite&#62;Amt und Gut Hanerau von den Anfängen bis 1664&#60;/cite&#62; (Neumünster, 1977)","secondary"
"1132","Schlesinger 1965","Schlesinger, Walter (Hrsg.), &#60;cite&#62;Handbuch der Historischen Stätten Deutschlands. Achter Band: Sachsen&#60;/cite&#62; (Stuttgart 1965).","secondary"
"1134","Kohl 1973","Kohl, Wilhelm (ed.), &#60;cite&#62;Regesten aus dem Archiv des Klosters und Stiftes Wietmarschen&#60;/cite&#62; (Nordhorn, 1973)","edition"
"1138","Boetticher 1996","Boetticher, Annette von, &#60;cite&#62;Geschichtliches Ortsverzeichnis des Landkreises Peine&#60;/cite&#62; (Hannover, 1996)","secondary"
"1148","Willert 1990","Willert, Helmut, &#60;cite&#62;Anfänge und frühe Entwicklung der Städte Kiel, Oldesloe und Plön&#60;/cite&#62; (Neumünster, 1990)","secondary"
"1150","Schmitz 1986","Schmitz, Antje, &#60;cite&#62;Die Orts- und Gewässernamen des Kreises Plön&#60;/cite&#62;, Kieler Beiträge zur deutschen Sprachgeschichte 8 (Neumünster, 1986)","secondary"
"1152","Laur 2012","Laur, Wolfgang, &#60;cite&#62;Die Orts- und Gewässernamen der Freien und Hansestadt Hamburg&#60;/cite&#62; (Neumünster, 2012)","secondary"
"1154","Bolland 1930","Bolland, Gustav, &#60;q&#62;Die Kuhmühle&#60;/q&#62;, &#60;cite&#62;Hamburgische Geschichts- und Heimatblätter&#60;/cite&#62; 5 (1930), 145-153","secondary"
"1156","Pauls 1913","Pauls, Volquart, &#60;q&#62;Die holsteinische Lokalverwaltung im 15. Jahrhundert&#60;/q&#62;, &#60;cite&#62;Zeitschrift der Gesellschaft für Schleswig-Holsteinische Geschichte&#60;/cite&#62; 43 (1913), 1-255","secondary"
"1158","Landgraf 1959","Landgraf, Henning, &#60;cite&#62;Bevölkerung und Wirtschaft Kiels im 15. Jahrhundert&#60;/cite&#62;, Quellen und Forschungen zur Geschichte Schleswig-Holsteins 39 (Neumünster, 1959)","secondary"
"1160","LASH Abt. 1","Landesarchiv Schleswig-Holstein, Schleswig, Abt. 1: Gemeinschaftliches Archiv","archive"
"1180","Scholand 1933/34","Scholand, Anton, &#60;cite&#62;Beiträge zur Geschichte der Stadt und des vormaligen Amtes Burgdorf&#60;/cite&#62; (Burgdorf-Lehrte, 1933/34)","secondary"
"1190","Siegemann; Schramme 1931","Siegemann, Theodor; Schramme, Wilhelm, &#60;cite&#62;Geschichte der Stadt Gronau&#60;/cite&#62; (Gronau (Hann.), 1931)","secondary"
"1192","Brockmann 1998","Brockmann, Bernhard, &#60;q&#62;Vom Großkirchspiel zur Wiek mit den Quartalen: Löningen im Mittelalter&#60;/q&#62;, in &#60;cite&#62;Löningen in Vergangenheit und Gegenwart. Zur Geschichte unserer Stadt, fünf Viertel und eine Wiek&#60;/cite&#62;, ed. by Margaretha Janssen (Löningen, 1998), 35-72","secondary"
"1196","Vogtherr 1996","Vogther, Hans-Jürgen (ed.), &#60;cite&#62;Die Lübecker Pfundzollbücher&#60;/cite&#62;, 4 Teile (Cologne Weimar Vienna, 1996)","edition"
"1222","Brunner 1913","Brunner, Hugo, &#60;cite&#62;Geschichte der Residenzstadt Cassel&#60;/cite&#62; (Kassel, 1913)","secondary"
"1224","Gehmlich 2008","Gehmlich, Klaus, &#60;cite&#62;Flurnamen im Landkreis Osterode am Harz&#60;/cite&#62;, 5 Bände (Clausthal-Zellerfeld, 2008)","secondary"
"1226","UB Hochstift Hildesheim","Janicke, Karl; Hoogeweg, Hermann (eds.), &#60;cite&#62;Urkundenbuch des Hochstifts Hildesheim und seiner Bischöfe&#60;/cite&#62;, 6 vols. (Hannover, 1896-1911)","edition"
"1240","Kalthammer 1983","Kalthammer, Wilhelm, &#60;cite&#62;Die Chronik von Hahausen. Mit vier Beiträgen von Arnold Jähns&#60;/cite&#62; (Hahausen, 1983)","secondary"
"1244","Wiese; Bölts 1966","Wiese, Heinz; Bölts, Johann, &#60;cite&#62;Rinderhandel und Rinderhaltung im nordwesteuropäischen Küstengebiet vom 15. bis zum 19. Jahrhundert&#60;/cite&#62; (Stuttgart, 1966)","secondary"
"1246","Schwetlik 1961","Schwetlik, Lothar, &#60;q&#62;Der hansisch-dänische Landhandel und seine Träger 1484-1519&#60;/q&#62;, &#60;cite&#62;Zeitschrift der Gesellschaft für Schleswig-Holsteinische Geschichte&#60;/cite&#62; 85/86 (1961), 61-130","secondary"
"1248","Imberger 1988","Imberger, Elke, &#60;q&#62;Itzehoe im Spätmittelalter und die Reformation (1303-1524)&#60;/q&#62;, in &#60;cite&#62;Itzehoe: Geschichte einer Stadt in Schleswig-Holstein, Bd. 1: Von der Frühgeschichte bis 1814&#60;/cite&#62; (Itzehoe, 1988), 31-42","secondary"
"1250","Schedlitz 1988","Schedlitz, Bernd, &#60;q&#62;Itzehoe während des Ständestaates und unter dem Frühabsolutismus (1524-1660)&#60;/q&#62;, in &#60;cite&#62;Itzehoe: Geschichte einer Stadt in Schleswig-Holstein, Bd. 1: Von der Frühgeschichte bis 1814&#60;/cite&#62; (Itzehoe, 1988), 62-80","secondary"
"1252","Schrecker 1933","Schrecker, Gertrud, &#60;q&#62;Das spätmittelalterliche Straßennetz in Holstein und Lauenburg&#60;/q&#62;, &#60;cite&#62;Zeitschrift der Gesellschaft für Schleswig-Holsteinische Geschichte&#60;/cite&#62; 16 (1933), 16-110","secondary"
"1264","Jensen2000","Jensen, Jørgen Elsøe, &#60;cite&#62;Danmarks Middelalderlige Byplaner. Nordøstsjælland og Bornholm&#60;/cite&#62;(Odense,2000)","secondary"
"1268","Schenck 1977","Schenck, Adolf, &#60;q&#62;Bemerkungen zum Namen der Fegetasche bei Plön. Zugleich ein Beitrag zur Geschichte der dortigen historischen Zollstätte&#60;/q&#62;, &#60;cite&#62;Jahrbuch für Heimatkunde im Kreis Plön&#60;/cite&#62; 7 (1977), 154-168","secondary"
"1270","Freytag 1986","Freytag, Hans-Joachim, &#60;q&#62;Anmerkungen zur Topographie Plöns im Mittelalter&#60;/q&#62;, &#60;cite&#62;Jahrbuch für Heimatkunde im Kreis Plön&#60;/cite&#62; 16 (1986), 103-116","secondary"
"1272","Marten 1969","Marten, Horst-Rüdiger, &#60;cite&#62;Die Entwicklung der Kulturlandschaft im alten Amt Aerzen des Landkreises Hameln-Pyrmont&#60;/cite&#62; (Göttingen, 1969)","secondary"
"1274","Klaube 2011","Klaube, Manfred, &#60;cite&#62;Altenau und Torfhaus im Oberharz&#60;/cite&#62; (Bockenem, 2011)","secondary"
"1276","Roth 1974","Roth, Otto, &#60;q&#62;Die Entwicklung Seesens von den Anfängen bis zum Dreißigjährigen Kriege&#60;/q&#62;, in &#60;cite&#62;Tausend Jahre Seesen. Beiträge zur Geschicht der Stadt Seesen am Harz&#60;/cite&#62; (Seesen, 1974), 25-88","secondary"
"1278","Palm 2003","Palm, Heike (ed.), &#60;cite&#62;Die Register des alten Amts Neustadt am Rübenberge&#60;/cite&#62; (Hannover, 2003)","edition"
"1280","Denecke 1969","Denecke, Dietrich, &#60;cite&#62;Methodische Untersuchungen zur historisch-geographischen Wegeforschung im Raum zwischen Solling und Harz. Ein Beitrag zur Rekonstruktion der mittelalterlichen Kulturlandschaft&#60;/cite&#62;, Göttinger geographische Abhandlungen 54 (Göttingen, 1969)","secondary"
"1282","Bahn 2015 (1964)","Bahn, Bernd, &#60;cite&#62;Die Kupferstraße. Geographisch-prähistorische Untersuchung ihres Verlaufs in Thüringen&#60;/cite&#62;, (Publikation der Dipl.-Arbeit von 1964) (Langenweißbach 2015).","secondary"
"1284","Haberland 1957","Haberland, Rudolf, &#60;cite&#62;Geschichte des Grenzgebietes Gartow-Schnackenburg, Teil I: von der Steinzeit bis zum Ausgang des Mittelalters&#60;/cite&#62; (Lüchow, 1957)","secondary"
"1286","Hofmeister 1979","Hofmeister, Adolf E., &#60;cite&#62;Besiedlung und Verfassung der Stader Elbmarschen im Mittelalter, Teil I: Die Stader Elbmarschen vor der Kolonisation des 12. Jahrhunderts&#60;/cite&#62; (Hildesheim, 1979)","secondary"
"1288","Hofmeister 1981","Hofmeister, Adolf E., &#60;cite&#62;Besiedlung und Verfassung der Stader Elbmarschen im Mittelalter, Teil II: Die Hollerkolonisation und die Landesgemeinden Land Kehdingen und Altes Land&#60;/cite&#62; (Hildesheim, 1981)","secondary"
"1290","Klenck 1957","Klenck, Willy, &#60;cite&#62;Heimatkunde des ehemaligen Kreises Neuhaus an der Oste&#60;/cite&#62; (Lamstedt, 1957)","secondary"
"1292","Koppe 2004","Koppe, Werner, &#60;cite&#62;Die Lipperwasserstraße: Schifffahrt auf Lippe und Lippe-Seitenkanal im Rahmen der nordwestdeutschen Binnenschifffahrtsgeschichte&#60;/cite&#62; (Bielefeld, 2004)","secondary"
"1294","Schulte 1982","Schulte, A.G., &#60;cite&#62;Het Rijk van Nijmegen. Westelijk gedeelte&#60;/cite&#62; (Zeist 1982).","secondary"
"1296","HOV Sachsen","Institut für Sächsiche Geschichte und Volkskunde, &#60;a href=&#34;https://hov.isgv.de&#34;&#62;Digitales Historisches Ortsverzeichnis von Sachsen.&#60;/a&#62;","secondary"
"1298","Van Enckevort 2019","Van Enckevort, Harry, &#60;cite&#62;Een 15e-eeuwse herberg buiten de stad. Een pleisterplaats voor reizigers aan de Hooge Weg (Wolfskuilseweg) in Nijmegen&#60;/cite&#62;, Archeologische Berichten Nijmegen Rapport 91 (Nijmegen, 2019).","secondary"
"1300","Historisches Ortsnamenbuch Sachsen I","Eichler, Ernst and Hans Walther (eds.), &#60;cite&#62;Historisches Ortsnamenbuch von Sachsen, Band 1: A - L.&#60;/cite&#62; (Berlin 2001).","secondary"
"1302","Historisches Ortsnamenbuch Sachsen II","Eichler, Ernst and Hans Walther (eds.), &#60;cite&#62;Historisches Ortsnamenbuch von Sachsen, Band 2: M - Z&#60;/cite&#62; (Berlin 2001).","secondary"
"1304","Barning; Schnakenberg 2013","Barning, Christel; Schnakenberg, Elisabeth, &#60;cite&#62;Bassen. Geschichte und Geschichten von 1259 bis heute&#60;/cite&#62; (Fischerhude, 2013)","secondary"
"1306","Scheuermann 1966","Scheuermann, Ulrich, &#60;q&#62;Die Ortsnamen des Kreises Rotenburg/Hann.&#60;/q&#62;, &#60;cite&#62;Rotenburger Schriften&#60;/cite&#62; 24 (1966), 34-67","secondary"
"1308","Rigsarkivet, Gottorp Toldregnskab","Rigsarkivet Copenhagen, Regnskaber 1438-1559, Slesvigske og Holstenske Regnskaber indtil 1580, Gottorp toldregnskab","archive"
"1310","LASH Abt. 7","Landesarchiv Schleswig-Holstein, Schleswig, Abt. 7: Herzöge von Schleswig-Holstein-Gottorf 1544-1713","archive"
"1312",,"Termeer, Henk, &#60;q&#62;Hees door de eeuwen heen; een geschiedenis in hoofdlijnen&#60;/q&#62;, in: &#60;cite&#62;Hees bij Nijmegen. Van dorp naar groene stadswijk, 1196-2011&#60;/cite&#62;, ed. by Jan Brauer, Henk Termeer (Hees, 2011), 8-21.","secondary"
"1314","Ekkers 2005","Ekkers, P., &#60;q&#62;De ruimtelijke ontwikkeling van Nijmegen: middeleeuwen (800-1500)&#60;/q&#62;, in &#60;cite&#62;Nijmegen. Geschiedenis van de oudste stad van Nederland. Deel 2 Middeleeuwen en Nieuwe Tijd&#60;/cite&#62;, ed. by Jan Kuys; Hans Bots (Wormer, 2005), 19-29.","secondary"
"1316","Klep 2005","Klep, Paul M.M., &#60;q&#62;Ondernemerschap in de Nieuwe Tijd&#60;/q&#62;, in &#60;cite&#62;Nijmegen. Geschiedenis van de oudste stad van Nederland. Deel 2 Middeleeuwen en Nieuwe Tijd&#60;/cite&#62;, ed. by Jan Kuys; Hans Bot (Wormer, 2005), 340-403.","secondary"
"1318","Klep; Thissen 2005","Klep, Paul M.M.; Thissen, Bert, &#60;q&#62;De economische en sociale ontwikkeling in de Middeleeuwen&#60;/q&#62;, in &#60;cite&#62;Nijmegen. Geschiedenis van de oudste stad van Nederland. Deel 2 Middeleeuwen en Nieuwe Tijd&#60;/cite&#62;, ed. by Jan Kuys; Hans Bots (Wormer, 2005), 48-153.","secondary"
"1320","Lemmens 2005","Lemmens, Gerard, &#60;q&#62;Architectuur en beeldende kunst in de Middeleeuwen&#60;/q&#62;, in &#60;cite&#62;Nijmegen. Geschiedenis van de oudste stad van Nederland. Deel 2 Middeleeuwen en Nieuwe Tijd&#60;/cite&#62;, ed. by Jan Kuys; Hans Bots (Wormer, 2005), 200-225.","secondary"
"1322","Kuys 2005","Kuys, Jan, &#60;q&#62;Stedelijk bestuur in de late Middeleeuwen tot 1543&#60;/q&#62;, in &#60;cite&#62;Nijmegen. Geschiedenis van de oudste stad van Nederland. Deel 2 Middeleeuwen en Nieuwe Tijd&#60;/cite&#62;, ed. by Jan Kuys; Hans Bots (Wormer, 2005), 247-262.","secondary"
"1324","De Jong 1960","De Jong, J.A.B.M., &#60;cite&#62;Het oud-archief der Gemeente Nijmegen. Deel 3 Brievenlijst Nos 1-1400&#60;/cite&#62; (Nijmegen, 1960).","edition"
"1326","Kuypers 1865","Kuypers, J., &#60;cite&#62;Gemeente atlas van de provincie Noordbrabant 1865&#60;/cite&#62; (1865).","edition"
"1328","Degn 2018","Degn, Ole, &#60;cite&#62;Fremgang, krise og stilstand&#60;/cite&#62; (Tarm, 2018)","secondary"
"1330","Brook 2003","Brook, August Heinrich von, &#60;q&#62;Fährmann, hol über!&#60;/q&#62;, in &#60;cite&#62;Die Oste. Lebensader zwischen Elbe und Weser&#60;/cite&#62;, ed. by August Heinrich von Brook and Gisela Tiedemann (Bremerhaven, 2003), 63-92","secondary"
"1332","Bachmann 2003","Bachmann, Elfriede, &#60;q&#62;Bremervörde und die Oste&#60;/q&#62;, in &#60;cite&#62;Die Oste. Lebensader zwischen Elbe und Weser&#60;/cite&#62;, ed. by August Heinrich von Brook and Gisela Tiedemann (Bremerhaven, 2003), 41-62","secondary"
"1334","Hagenah; Döpke 2004","Hagenah, Egon; Döpke, Wolfgang, &#60;cite&#62;Dollern. Die Dorfgeschichte&#60;/cite&#62; (Stade, 2004)","secondary"
"1336","Müller 1998","Müller, Hans-Ehrhard, &#60;cite&#62;Helmstedt. Geschichte einer deutschen Stadt&#60;/cite&#62; (Helmstedt, 1998)","secondary"
"1338","Budde 1998","Budde, Thomas, &#60;cite&#62;Die Helmstedter Landwehr. Ein Beitrag zur Erforschung mittelalterlicher Grenzbefestigungen&#60;/cite&#62;, Arbeitshefte zur Denkmalpflege in Niedersachsen 16 (Hameln, 1998)","secondary"
"1340","Röhr 1981","Röhr, Heinz, &#60;cite&#62;Geschichte der Stadt Königslutter am Elm&#60;/cite&#62; (Braunschweig, 1981)","secondary"
"1342","Bachmann 1966","Bachmann, Elfriede, &#60;cite&#62;Das Kloster Heeslingen-Zeven. Verfassungs- und Wirtschaftsgeschichte&#60;/cite&#62; (Stade, 1966)","secondary"
"1344","museumwijchen.nl","&#60;a href=&#34;https://www.museumwijchen.nl/geschiedenis-kasteel/&#34;&#62;&#60;/a&#62;","secondary"
"1346","Website Museum Wijchen","&#60;q&#62;Kasteel Wijchen - een korte geschiedenis&#60;/q&#62;, Website Museum Wijchen (&#60;a href=&#34;https://www.museumwijchen.nl/geschiedenis-kasteel/&#34;&#62;https://www.museumwijchen.nl/geschiedenis-kasteel/&#60;/a&#62;)","secondary"
"1348","Baasch 1889","Baasch, Ernst, &#60;cite&#62;Die Islandfahrt der Deutschen: namentlich der Hamburger, vom 15. bis 17. Jahrhundert&#60;/cite&#62;, Forschungen zur hamburgischen Handelsgeschichte 1 (Hamburg, 1889)","secondary"
"1350","Holterman 2020","Holterman, Bart, &#60;cite&#62;The Fish Lands. German trade with Iceland, Shetland and the Faroe Islands in the late 15th and 16th Century&#60;/cite&#62; (Berlin, 2020)","secondary"
"1352","Brepohl 1984","Brepohl, Wilhelm, &#60;q&#62;Aus der Geschichte der Stadt Petershagen und ihrer Ortschaften&#60;/q&#62;, in &#60;cite&#62;1200 Jahre Petershagen&#60;/cite&#62; (Petershagen, 1984), 37-63","secondary"
"1354","Noviomagus Special Stratenloop","&#60;q&#62;Noviomagus Special Stratenloop&#60;/q&#62;, Website Noviomagus (&#60;a href=&#34;https://www.noviomagus.nl/Specials/Stratenloop/Wolfskuil.htm&#34;&#62;https://www.noviomagus.nl/Specials/Stratenloop/Wolfskuil.htm&#60;/a&#62;).","secondary"
"1356","Hoop 1989","Hoop, Edward, &#60;cite&#62;Geschichte der Stadt Rendsburg&#60;/cite&#62; (Rendsburg, 1989)","secondary"
"1358","Pohl 1991","Pohl, Meinhard, &#60;q&#62;Wesel im Hohen Mittelalter&#60;/q&#62;, in &#60;cite&#62;Geschichte der Stadt Wesel, Band 1&#60;/cite&#62;, ed. by Jutta Prieur (Düsseldorf, 1991), 77-109&#13;&#10;","secondary"
"1360","Gundermann 1879","Gundermann, Ferdinand, &#60;cite&#62;Chronik der Stadt Eilenburg: nach Quellen bearbeitet.&#60;/cite&#62; (Eilenburg 1879).","secondary"
"1362","Logemann 1997","Logemann, Silke, &#60;q&#62;Grundzüge der Geschichte der Stadt Halberstadt.&#60;/q&#62; in: Berg, Dieter (ed.), &#60;cite&#62;Bürger, Bettelmönche und Bischöfe in Halberstadt: Studien zur Geschichte der Stadt, der Mendikanten und des Bistums vom Mittelalter bis zur Frühen Neuzeit.&#60;/cite&#62; (Werl 1997).","secondary"
"1364","Urkundenbuch Halberstadt 1878/1879","Urkundenbuch der Stadt Halberstadt, ed. by Gustav Schmidt, 2 Bde., (Halle 1878/1879). (referred to here: &#60;a href=&#34;https://archive.org/details/urkundenbuchder01schmgoog/page/n450/mode/2up&#34;&#62;https://archive.org/details/urkundenbuchder01schmgoog/page/n450/mode/2up&#60;/a&#62;, on 21.07.2020)","secondary"
"1366","Schäfer 1926","Schäfer, Aloys, &#60;cite&#62;Geschichte der Stadt Dingelstädt.&#60;/cite&#62; (Dingelstädt 1926).","secondary"
"1368","Müller 1914","Müller, Theodor, &#60;cite&#62;Geschichte der Stadt und des Amts Oebisfelde nebst Urkundensammlung.&#60;/cite&#62; (Oebisfelde 1914).","secondary"
"1370","Heinrich 1973","Heinrich, Gerd (Hrsg.), &#60;cite&#62;Handbuch der historischen Stätten: Berlin und Brandenburg.&#60;/cite&#62; (Stuttgart 1973).","secondary"
"1372","Engel et al. 2000","Engel, Evamaria; Lieselott Enders; Gerd Heinrich and Winfried Schich (eds.), &#60;cite&#62;Städtebuch Brandenburg und Berlin.&#60;/cite&#62; (Stuttgart a.o. 2000).","secondary"
"1374","ONB Celle","Dolle, Josef (ed.), &#60;cite&#62;Niedersächsisches Ortsnamenbuch, Landkreis Celle&#60;/cite&#62; (in preparation)","secondary"
"1376","NLA WO 60 Urk. no. 98","Niedersächsisches Landesarchiv Wolfenbüttel, 60 Urkunden Nr. 98.","archive"
"1378","Rödiger 1922","Rödiger, Paul, &#60;cite&#62;Mein Kindelbrück. Ein Heimatbuch&#60;/cite&#62; (Kindelbrück 1922).","secondary"
"1380","Kuhlbrodt 2015","Kuhlbrodt, Peter,&#60;cite&#62; Nordhausen - Eine Reichsstadt im Jahrhundert der Reformation.&#60;/cite&#62; (Nordhausen 2015).","secondary"
"1382","Hermes; Weigelt 1842","Hermes, J.A.F.; Weigelt, M.J. (eds.), &#60;cite&#62;Historisch-geographisch-statistisch-geographisches Handbuch vom Regierungsbezirke Magdeburg&#60;/cite&#62;, 2. Theil (Magdeburg, 1842)","secondary"
"1384","Wegewitz 1950","Wegewitz, Willi, &#60;cite&#62;Harburger Heimat. Die Landschaft um Hamburg-Harburg&#60;/cite&#62; (Hamburg, 1950)","secondary"
"1386","Holst 1983","Holst, Friedrich, &#60;cite&#62;Roland und die Kraniche. Die Geschichte der Ostedörfer Kranenburg und Brobergen&#60;/cite&#62; (Kranenburg, 1983)","secondary"
"1388","Pröve 1929","Pröve, Heinrich, &#60;cite&#62;Dorf und Gut im alten Herzogtum Lüneburg&#60;/cite&#62; (Göttingen, 1929)","secondary"
"1390","Jürries; Wachter 200","Jürries, Wolfgang; Wachter, Berndt, &#60;cite&#62;Wendland Lexikon, Band 1: A-K&#60;/cite&#62; (Lüchow, 2000)","secondary"
"1392","Jürries 2008","Jürries, Wolfgang (ed.), &#60;cite&#62;Wendland Lexikon, Band 2: L-Z&#60;/cite&#62; (Lüchow, 2008)","secondary"
